tvm_tuner/fp32/matmul_1024x1024x1.json
{"i": [["[\"matmul\", 1024, 1024, 1, \"float32\"]", "cuda -keys=cuda,gpu -arch=sm_80 -max_num_threads=1024 -thread_warp_size=32", [-1, 16, 64, 49152, 2147483647, 1024, 8, 32], "", 0, []], [[], [["CHW", 2, "local"], ["SP", 2, 0, 1024, [2, 32, 2, 8], 1], ["SP", 2, 5, 1024, [2, 16, 1, 1], 1], ["SP", 2, 10, 1, [1, 1], 1], ["RE", 2, [0, 5, 1, 6, 2, 7, 10, 11, 3, 8, 12, 4, 9]], ["FSP", 3, 0, 1, 3], ["FSP", 3, 4, 2, 3], ["RE", 3, [0, 4, 1, 5, 2, 6, 3, 7]], ["CA", 2, 3, 5], ["CHR", 1, "shared", [2]], ["CA", 2, 3, 6], ["CHR", 0, "shared", [3]], ["CA", 1, 4, 6], ["FU", 5, [0, 1]], ["AN", 5, 0, 5], ["FU", 5, [1, 2]], ["AN", 5, 1, 4], ["FU", 5, [2, 3]], ["AN", 5, 2, 6], ["FU", 3, [0, 1]], ["SP", 3, 0, 4, [4], 1], ["AN", 3, 1, 2], ["FFSP", 3, 0, [2, 1], 1, 1], ["AN", 3, 1, 6], ["FU", 1, [0, 1]], ["SP", 1, 0, 16, [1], 1], ["AN", 1, 1, 2], ["FFSP", 1, 0, [2, 1], 1, 1], ["AN", 1, 1, 6], ["PR", 4, 0, "auto_unroll_max_step$512"]]]], "r": [[6.09844e-06], 0, 2.01682, 1652873166], "v": "v0.6"}
{"i": [["[\"matmul\", 1024, 1024, 1, \"float32\"]", "cuda -keys=cuda,gpu -arch=sm_80 -max_num_threads=1024 -thread_warp_size=32", [-1, 16, 64, 49152, 2147483647, 1024, 8, 32], "", 0, []], [[], [["CHW", 2, "local"], ["SP", 2, 0, 1024, [2, 128, 1, 1], 1], ["SP", 2, 5, 1024, [1, 4, 1, 16], 1], ["SP", 2, 10, 1, [1, 1], 1], ["RE", 2, [0, 5, 1, 6, 2, 7, 10, 11, 3, 8, 12, 4, 9]], ["FSP", 3, 0, 1, 3], ["FSP", 3, 4, 2, 3], ["RE", 3, [0, 4, 1, 5, 2, 6, 3, 7]], ["CA", 2, 3, 5], ["CHR", 1, "shared", [2]], ["CA", 2, 3, 6], ["CHR", 0, "shared", [3]], ["CA", 1, 4, 6], ["FU", 5, [0, 1]], ["AN", 5, 0, 5], ["FU", 5, [1, 2]], ["AN", 5, 1, 4], ["FU", 5, [2, 3]], ["AN", 5, 2, 6], ["FU", 3, [0, 1]], ["SP", 3, 0, 16, [1], 1], ["AN", 3, 1, 2], ["FFSP", 3, 0, [2, 1], 1, 1], ["AN", 3, 1, 6], ["FU", 1, [0, 1]], ["SP", 1, 0, 1, [1], 1], ["AN", 1, 1, 2], ["FFSP", 1, 0, [2, 1], 1, 1], ["AN", 1, 1, 6], ["PR", 4, 0, "auto_unroll_max_step$0"]]]], "r": [[2.24355e-05], 0, 1.77491, 1652873167], "v": "v0.6"}
{"i": [["[\"matmul\", 1024, 1024, 1, \"float32\"]", "cuda -keys=cuda,gpu -arch=sm_80 -max_num_threads=1024 -thread_warp_size=32", [-1, 16, 64, 49152, 2147483647, 1024, 8, 32], "", 0, []], [[], [["CHW", 2, "local"], ["SP", 2, 0, 1024, [2, 4, 32, 1], 1], ["SP", 2, 5, 1024, [1, 16, 2, 16], 1], ["SP", 2, 10, 1, [1, 1], 1], ["RE", 2, [0, 5, 1, 6, 2, 7, 10, 11, 3, 8, 12, 4, 9]], ["FSP", 3, 0, 1, 3], ["FSP", 3, 4, 2, 3], ["RE", 3, [0, 4, 1, 5, 2, 6, 3, 7]], ["CA", 2, 3, 5], ["CHR", 1, "shared", [2]], ["CA", 2, 3, 6], ["CHR", 0, "shared", [3]], ["CA", 1, 4, 6], ["FU", 5, [0, 1]], ["AN", 5, 0, 5], ["FU", 5, [1, 2]], ["AN", 5, 1, 4], ["FU", 5, [2, 3]], ["AN", 5, 2, 6], ["FU", 3, [0, 1]], ["SP", 3, 0, 32, [1], 1], ["AN", 3, 1, 2], ["FFSP", 3, 0, [2, 1], 1, 1], ["AN", 3, 1, 6], ["FU", 1, [0, 1]], ["SP", 1, 0, 32, [1], 1], ["AN", 1, 1, 2], ["FFSP", 1, 0, [2, 1], 1, 1], ["AN", 1, 1, 6], ["PR", 4, 0, "auto_unroll_max_step$512"]]]], "r": [[0.00023392], 0, 2.48521, 1652873169], "v": "v0.6"}
{"i": [["[\"matmul\", 1024, 1024, 1, \"float32\"]", "cuda -keys=cuda,gpu -arch=sm_80 -max_num_threads=1024 -thread_warp_size=32", [-1, 16, 64, 49152, 2147483647, 1024, 8, 32], "", 0, []], [[], [["CHW", 2, "local"], ["SP", 2, 0, 1024, [2, 8, 1, 16], 1], ["SP", 2, 5, 1024, [1, 64, 2, 2], 1], ["SP", 2, 10, 1, [1, 1], 1], ["RE", 2, [0, 5, 1, 6, 2, 7, 10, 11, 3, 8, 12, 4, 9]], ["FSP", 3, 0, 1, 3], ["FSP", 3, 4, 2, 3], ["RE", 3, [0, 4, 1, 5, 2, 6, 3, 7]], ["CA", 2, 3, 5], ["CHR", 1, "shared", [2]], ["CA", 2, 3, 6], ["CHR", 0, "shared", [3]], ["CA", 1, 4, 6], ["FU", 5, [0, 1]], ["AN", 5, 0, 5], ["FU", 5, [1, 2]], ["AN", 5, 1, 4], ["FU", 5, [2, 3]], ["AN", 5, 2, 6], ["FU", 3, [0, 1]], ["SP", 3, 0, 4, [1], 1], ["AN", 3, 1, 2], ["FFSP", 3, 0, [2, 1], 1, 1], ["AN", 3, 1, 6], ["FU", 1, [0, 1]], ["SP", 1, 0, 16, [8], 1], ["AN", 1, 1, 2], ["FFSP", 1, 0, [2, 1], 1, 1], ["AN", 1, 1, 6], ["PR", 4, 0, "auto_unroll_max_step$0"]]]], "r": [[3.05951e-05], 0, 1.94404, 1652873170], "v": "v0.6"}
{"i": [["[\"matmul\", 1024, 1024, 1, \"float32\"]", "cuda -keys=cuda,gpu -arch=sm_80 -max_num_threads=1024 -thread_warp_size=32", [-1, 16, 64, 49152, 2147483647, 1024, 8, 32], "", 0, []], [[], [["CHW", 2, "local"], ["SP", 2, 0, 1024, [1, 1, 128, 1], 1], ["SP", 2, 5, 1024, [1, 64, 8, 2], 1], ["SP", 2, 10, 1, [1, 1], 1], ["RE", 2, [0, 5, 1, 6, 2, 7, 10, 11, 3, 8, 12, 4, 9]], ["FSP", 3, 0, 1, 3], ["FSP", 3, 4, 2, 3], ["RE", 3, [0, 4, 1, 5, 2, 6, 3, 7]], ["CA", 2, 3, 5], ["CHR", 1, "shared", [2]], ["CA", 2, 3, 6], ["CHR", 0, "shared", [3]], ["CA", 1, 4, 6], ["FU", 5, [0, 1]], ["AN", 5, 0, 5], ["FU", 5, [1, 2]], ["AN", 5, 1, 4], ["FU", 5, [2, 3]], ["AN", 5, 2, 6], ["FU", 3, [0, 1]], ["SP", 3, 0, 32, [1], 1], ["AN", 3, 1, 2], ["FFSP", 3, 0, [2, 1], 1, 1], ["AN", 3, 1, 6], ["FU", 1, [0, 1]], ["SP", 1, 0, 512, [1], 1], ["AN", 1, 1, 2], ["FFSP", 1, 0, [2, 1], 1, 1], ["AN", 1, 1, 6], ["PR", 4, 0, "auto_unroll_max_step$64"]]]], "r": [[0.000184762], 0, 1.99568, 1652873171], "v": "v0.6"}
{"i": [["[\"matmul\", 1024, 1024, 1, \"float32\"]", "cuda -keys=cuda,gpu -arch=sm_80 -max_num_threads=1024 -thread_warp_size=32", [-1, 16, 64, 49152, 2147483647, 1024, 8, 32], "", 0, []], [[], [["CHW", 2, "local"], ["SP", 2, 0, 1024, [1, 8, 1, 8], 1], ["SP", 2, 5, 1024, [8, 4, 8, 2], 1], ["SP", 2, 10, 1, [1, 1], 1], ["RE", 2, [0, 5, 1, 6, 2, 7, 10, 11, 3, 8, 12, 4, 9]], ["FSP", 3, 0, 1, 3], ["FSP", 3, 4, 2, 3], ["RE", 3, [0, 4, 1, 5, 2, 6, 3, 7]], ["CA", 2, 3, 5], ["CHR", 1, "shared", [2]], ["CA", 2, 3, 6], ["CHR", 0, "shared", [3]], ["CA", 1, 4, 6], ["FU", 5, [0, 1]], ["AN", 5, 0, 5], ["FU", 5, [1, 2]], ["AN", 5, 1, 4], ["FU", 5, [2, 3]], ["AN", 5, 2, 6], ["FU", 3, [0, 1]], ["SP", 3, 0, 16, [1], 1], ["AN", 3, 1, 2], ["FFSP", 3, 0, [2, 1], 1, 1], ["AN", 3, 1, 6], ["FU", 1, [0, 1]], ["SP", 1, 0, 8, [2], 1], ["AN", 1, 1, 2], ["FFSP", 1, 0, [2, 1], 1, 1], ["AN", 1, 1, 6], ["PR", 4, 0, "auto_unroll_max_step$64"]]]], "r": [[4.0298e-05], 0, 2.7124, 1652873172], "v": "v0.6"}
{"i": [["[\"matmul\", 1024, 1024, 1, \"float32\"]", "cuda -keys=cuda,gpu -arch=sm_80 -max_num_threads=1024 -thread_warp_size=32", [-1, 16, 64, 49152, 2147483647, 1024, 8, 32], "", 0, []], [[], [["CHW", 2, "local"], ["SP", 2, 0, 1024, [4, 2, 16, 2], 1], ["SP", 2, 5, 1024, [2, 16, 2, 2], 1], ["SP", 2, 10, 1, [1, 1], 1], ["RE", 2, [0, 5, 1, 6, 2, 7, 10, 11, 3, 8, 12, 4, 9]], ["FSP", 3, 0, 1, 3], ["FSP", 3, 4, 2, 3], ["RE", 3, [0, 4, 1, 5, 2, 6, 3, 7]], ["CA", 2, 3, 5], ["CHR", 1, "shared", [2]], ["CA", 2, 3, 6], ["CHR", 0, "shared", [3]], ["CA", 1, 4, 6], ["FU", 5, [0, 1]], ["AN", 5, 0, 5], ["FU", 5, [1, 2]], ["AN", 5, 1, 4], ["FU", 5, [2, 3]], ["AN", 5, 2, 6], ["FU", 3, [0, 1]], ["SP", 3, 0, 4, [1], 1], ["AN", 3, 1, 2], ["FFSP", 3, 0, [2, 1], 1, 1], ["AN", 3, 1, 6], ["FU", 1, [0, 1]], ["SP", 1, 0, 32, [1], 1], ["AN", 1, 1, 2], ["FFSP", 1, 0, [2, 1], 1, 1], ["AN", 1, 1, 6], ["PR", 4, 0, "auto_unroll_max_step$1024"]]]], "r": [[2.04609e-05], 0, 7.17677, 1652873174], "v": "v0.6"}
{"i": [["[\"matmul\", 1024, 1024, 1, \"float32\"]", "cuda -keys=cuda,gpu -arch=sm_80 -max_num_threads=1024 -thread_warp_size=32", [-1, 16, 64, 49152, 2147483647, 1024, 8, 32], "", 0, []], [[], [["CHW", 2, "local"], ["SP", 2, 0, 1024, [4, 1, 8, 8], 1], ["SP", 2, 5, 1024, [1, 64, 1, 4], 1], ["SP", 2, 10, 1, [1, 1], 1], ["RE", 2, [0, 5, 1, 6, 2, 7, 10, 11, 3, 8, 12, 4, 9]], ["FSP", 3, 0, 1, 3], ["FSP", 3, 4, 2, 3], ["RE", 3, [0, 4, 1, 5, 2, 6, 3, 7]], ["CA", 2, 3, 5], ["CHR", 1, "shared", [2]], ["CA", 2, 3, 6], ["CHR", 0, "shared", [3]], ["CA", 1, 4, 6], ["FU", 5, [0, 1]], ["AN", 5, 0, 5], ["FU", 5, [1, 2]], ["AN", 5, 1, 4], ["FU", 5, [2, 3]], ["AN", 5, 2, 6], ["FU", 3, [0, 1]], ["SP", 3, 0, 4, [1], 1], ["AN", 3, 1, 2], ["FFSP", 3, 0, [2, 1], 1, 1], ["AN", 3, 1, 6], ["FU", 1, [0, 1]], ["SP", 1, 0, 64, [1], 1], ["AN", 1, 1, 2], ["FFSP", 1, 0, [2, 1], 1, 1], ["AN", 1, 1, 6], ["PR", 4, 0, "auto_unroll_max_step$16"]]]], "r": [[3.56714e-05], 0, 2.70582, 1652873175], "v": "v0.6"}
{"i": [["[\"matmul\", 1024, 1024, 1, \"float32\"]", "cuda -keys=cuda,gpu -arch=sm_80 -max_num_threads=1024 -thread_warp_size=32", [-1, 16, 64, 49152, 2147483647, 1024, 8, 32], "", 0, []], [[], [["CHW", 2, "local"], ["SP", 2, 0, 1024, [1, 4, 1, 64], 1], ["SP", 2, 5, 1024, [4, 2, 1, 1], 1], ["SP", 2, 10, 1, [1, 1], 1], ["RE", 2, [0, 5, 1, 6, 2, 7, 10, 11, 3, 8, 12, 4, 9]], ["FSP", 3, 0, 1, 3], ["FSP", 3, 4, 2, 3], ["RE", 3, [0, 4, 1, 5, 2, 6, 3, 7]], ["CA", 2, 3, 5], ["CHR", 1, "shared", [2]], ["CA", 2, 3, 6], ["CHR", 0, "shared", [3]], ["CA", 1, 4, 6], ["FU", 5, [0, 1]], ["AN", 5, 0, 5], ["FU", 5, [1, 2]], ["AN", 5, 1, 4], ["FU", 5, [2, 3]], ["AN", 5, 2, 6], ["FU", 3, [0, 1]], ["SP", 3, 0, 2, [1], 1], ["AN", 3, 1, 2], ["FFSP", 3, 0, [2, 1], 1, 1], ["AN", 3, 1, 6], ["FU", 1, [0, 1]], ["SP", 1, 0, 16, [1], 1], ["AN", 1, 1, 2], ["FFSP", 1, 0, [2, 1], 1, 1], ["AN", 1, 1, 6], ["PR", 4, 0, "auto_unroll_max_step$16"]]]], "r": [[8.01773e-06], 0, 2.01298, 1652873176], "v": "v0.6"}
{"i": [["[\"matmul\", 1024, 1024, 1, \"float32\"]", "cuda -keys=cuda,gpu -arch=sm_80 -max_num_threads=1024 -thread_warp_size=32", [-1, 16, 64, 49152, 2147483647, 1024, 8, 32], "", 0, []], [[], [["CHW", 2, "local"], ["SP", 2, 0, 1024, [4, 8, 2, 1], 1], ["SP", 2, 5, 1024, [1, 2, 2, 64], 1], ["SP", 2, 10, 1, [1, 1], 1], ["RE", 2, [0, 5, 1, 6, 2, 7, 10, 11, 3, 8, 12, 4, 9]], ["FSP", 3, 0, 1, 3], ["FSP", 3, 4, 2, 3], ["RE", 3, [0, 4, 1, 5, 2, 6, 3, 7]], ["CA", 2, 3, 5], ["CHR", 1, "shared", [2]], ["CA", 2, 3, 6], ["CHR", 0, "shared", [3]], ["CA", 1, 4, 6], ["FU", 5, [0, 1]], ["AN", 5, 0, 5], ["FU", 5, [1, 2]], ["AN", 5, 1, 4], ["FU", 5, [2, 3]], ["AN", 5, 2, 6], ["FU", 3, [0, 1]], ["SP", 3, 0, 64, [1], 1], ["AN", 3, 1, 2], ["FFSP", 3, 0, [2, 1], 1, 1], ["AN", 3, 1, 6], ["FU", 1, [0, 1]], ["SP", 1, 0, 2, [1], 1], ["AN", 1, 1, 2], ["FFSP", 1, 0, [2, 1], 1, 1], ["AN", 1, 1, 6], ["PR", 4, 0, "auto_unroll_max_step$64"]]]], "r": [[3.4493e-05], 0, 4.07485, 1652873177], "v": "v0.6"}
{"i": [["[\"matmul\", 1024, 1024, 1, \"float32\"]", "cuda -keys=cuda,gpu -arch=sm_80 -max_num_threads=1024 -thread_warp_size=32", [-1, 16, 64, 49152, 2147483647, 1024, 8, 32], "", 0, []], [[], [["CHW", 2, "local"], ["SP", 2, 0, 1024, [1, 512, 1, 2], 1], ["SP", 2, 5, 1024, [1, 1, 32, 1], 1], ["SP", 2, 10, 1, [1, 1], 1], ["RE", 2, [0, 5, 1, 6, 2, 7, 10, 11, 3, 8, 12, 4, 9]], ["FSP", 3, 0, 1, 3], ["FSP", 3, 4, 2, 3], ["RE", 3, [0, 4, 1, 5, 2, 6, 3, 7]], ["CA", 2, 3, 5], ["CHR", 1, "shared", [2]], ["CA", 2, 3, 6], ["CHR", 0, "shared", [3]], ["CA", 1, 4, 6], ["FU", 5, [0, 1]], ["AN", 5, 0, 5], ["FU", 5, [1, 2]], ["AN", 5, 1, 4], ["FU", 5, [2, 3]], ["AN", 5, 2, 6], ["FU", 3, [0, 1]], ["SP", 3, 0, 32, [1], 1], ["AN", 3, 1, 2], ["FFSP", 3, 0, [2, 1], 1, 1], ["AN", 3, 1, 6], ["FU", 1, [0, 1]], ["SP", 1, 0, 2, [1], 1], ["AN", 1, 1, 2], ["FFSP", 1, 0, [2, 1], 1, 1], ["AN", 1, 1, 6], ["PR", 4, 0, "auto_unroll_max_step$0"]]]], "r": [[4.95588e-05], 0, 1.80979, 1652873178], "v": "v0.6"}
{"i": [["[\"matmul\", 1024, 1024, 1, \"float32\"]", "cuda -keys=cuda,gpu -arch=sm_80 -max_num_threads=1024 -thread_warp_size=32", [-1, 16, 64, 49152, 2147483647, 1024, 8, 32], "", 0, []], [[], [["CHW", 2, "local"], ["SP", 2, 0, 1024, [1, 4, 64, 4], 1], ["SP", 2, 5, 1024, [1, 8, 16, 8], 1], ["SP", 2, 10, 1, [1, 1], 1], ["RE", 2, [0, 5, 1, 6, 2, 7, 10, 11, 3, 8, 12, 4, 9]], ["FSP", 3, 0, 1, 3], ["FSP", 3, 4, 2, 3], ["RE", 3, [0, 4, 1, 5, 2, 6, 3, 7]], ["CA", 2, 3, 5], ["CHR", 1, "shared", [2]], ["CA", 2, 3, 6], ["CHR", 0, "shared", [3]], ["CA", 1, 4, 6], ["FU", 5, [0, 1]], ["AN", 5, 0, 5], ["FU", 5, [1, 2]], ["AN", 5, 1, 4], ["FU", 5, [2, 3]], ["AN", 5, 2, 6], ["FU", 3, [0, 1]], ["SP", 3, 0, 64, [1], 1], ["AN", 3, 1, 2], ["FFSP", 3, 0, [2, 1], 1, 1], ["AN", 3, 1, 6], ["FU", 1, [0, 1]], ["SP", 1, 0, 256, [1], 1], ["AN", 1, 1, 2], ["FFSP", 1, 0, [2, 1], 1, 1], ["AN", 1, 1, 6], ["PR", 4, 0, "auto_unroll_max_step$16"]]]], "r": [[0.00215432], 0, 3.21962, 1652873179], "v": "v0.6"}
{"i": [["[\"matmul\", 1024, 1024, 1, \"float32\"]", "cuda -keys=cuda,gpu -arch=sm_80 -max_num_threads=1024 -thread_warp_size=32", [-1, 16, 64, 49152, 2147483647, 1024, 8, 32], "", 0, []], [[], [["CHW", 2, "local"], ["SP", 2, 0, 1024, [8, 8, 4, 2], 1], ["SP", 2, 5, 1024, [1, 16, 2, 4], 1], ["SP", 2, 10, 1, [1, 1], 1], ["RE", 2, [0, 5, 1, 6, 2, 7, 10, 11, 3, 8, 12, 4, 9]], ["FSP", 3, 0, 1, 3], ["FSP", 3, 4, 2, 3], ["RE", 3, [0, 4, 1, 5, 2, 6, 3, 7]], ["CA", 2, 3, 5], ["CHR", 1, "shared", [2]], ["CA", 2, 3, 6], ["CHR", 0, "shared", [3]], ["CA", 1, 4, 6], ["FU", 5, [0, 1]], ["AN", 5, 0, 5], ["FU", 5, [1, 2]], ["AN", 5, 1, 4], ["FU", 5, [2, 3]], ["AN", 5, 2, 6], ["FU", 3, [0, 1]], ["SP", 3, 0, 8, [4], 1], ["AN", 3, 1, 2], ["FFSP", 3, 0, [2, 1], 1, 1], ["AN", 3, 1, 6], ["FU", 1, [0, 1]], ["SP", 1, 0, 8, [1], 1], ["AN", 1, 1, 2], ["FFSP", 1, 0, [2, 1], 1, 1], ["AN", 1, 1, 6], ["PR", 4, 0, "auto_unroll_max_step$512"]]]], "r": [[4.73125e-05], 0, 4.13202, 1652873181], "v": "v0.6"}
{"i": [["[\"matmul\", 1024, 1024, 1, \"float32\"]", "cuda -keys=cuda,gpu -arch=sm_80 -max_num_threads=1024 -thread_warp_size=32", [-1, 16, 64, 49152, 2147483647, 1024, 8, 32], "", 0, []], [[], [["CHW", 2, "local"], ["SP", 2, 0, 1024, [1, 32, 2, 4], 1], ["SP", 2, 5, 1024, [1, 16, 2, 1], 1], ["SP", 2, 10, 1, [1, 1], 1], ["RE", 2, [0, 5, 1, 6, 2, 7, 10, 11, 3, 8, 12, 4, 9]], ["FSP", 3, 0, 1, 3], ["FSP", 3, 4, 2, 3], ["RE", 3, [0, 4, 1, 5, 2, 6, 3, 7]], ["CA", 2, 3, 5], ["CHR", 1, "shared", [2]], ["CA", 2, 3, 6], ["CHR", 0, "shared", [3]], ["CA", 1, 4, 6], ["FU", 5, [0, 1]], ["AN", 5, 0, 5], ["FU", 5, [1, 2]], ["AN", 5, 1, 4], ["FU", 5, [2, 3]], ["AN", 5, 2, 6], ["FU", 3, [0, 1]], ["SP", 3, 0, 2, [1], 1], ["AN", 3, 1, 2], ["FFSP", 3, 0, [2, 1], 1, 1], ["AN", 3, 1, 6], ["FU", 1, [0, 1]], ["SP", 1, 0, 8, [1], 1], ["AN", 1, 1, 2], ["FFSP", 1, 0, [2, 1], 1, 1], ["AN", 1, 1, 6], ["PR", 4, 0, "auto_unroll_max_step$0"]]]], "r": [[6.66856e-06], 0, 1.58174, 1652873182], "v": "v0.6"}
{"i": [["[\"matmul\", 1024, 1024, 1, \"float32\"]", "cuda -keys=cuda,gpu -arch=sm_80 -max_num_threads=1024 -thread_warp_size=32", [-1, 16, 64, 49152, 2147483647, 1024, 8, 32], "", 0, []], [[], [["CHW", 2, "local"], ["SP", 2, 0, 1024, [1, 128, 2, 2], 1], ["SP", 2, 5, 1024, [4, 1, 4, 16], 1], ["SP", 2, 10, 1, [1, 1], 1], ["RE", 2, [0, 5, 1, 6, 2, 7, 10, 11, 3, 8, 12, 4, 9]], ["FSP", 3, 0, 1, 3], ["FSP", 3, 4, 2, 3], ["RE", 3, [0, 4, 1, 5, 2, 6, 3, 7]], ["CA", 2, 3, 5], ["CHR", 1, "shared", [2]], ["CA", 2, 3, 6], ["CHR", 0, "shared", [3]], ["CA", 1, 4, 6], ["FU", 5, [0, 1]], ["AN", 5, 0, 5], ["FU", 5, [1, 2]], ["AN", 5, 1, 4], ["FU", 5, [2, 3]], ["AN", 5, 2, 6], ["FU", 3, [0, 1]], ["SP", 3, 0, 128, [1], 1], ["AN", 3, 1, 2], ["FFSP", 3, 0, [2, 1], 1, 1], ["AN", 3, 1, 6], ["FU", 1, [0, 1]], ["SP", 1, 0, 4, [1], 1], ["AN", 1, 1, 2], ["FFSP", 1, 0, [2, 1], 1, 1], ["AN", 1, 1, 6], ["PR", 4, 0, "auto_unroll_max_step$0"]]]], "r": [[0.000219392], 0, 4.48287, 1652873183], "v": "v0.6"}
{"i": [["[\"matmul\", 1024, 1024, 1, \"float32\"]", "cuda -keys=cuda,gpu -arch=sm_80 -max_num_threads=1024 -thread_warp_size=32", [-1, 16, 64, 49152, 2147483647, 1024, 8, 32], "", 0, []], [[], [["CHW", 2, "local"], ["SP", 2, 0, 1024, [8, 8, 1, 2], 1], ["SP", 2, 5, 1024, [1, 32, 2, 16], 1], ["SP", 2, 10, 1, [1, 1], 1], ["RE", 2, [0, 5, 1, 6, 2, 7, 10, 11, 3, 8, 12, 4, 9]], ["FSP", 3, 0, 1, 3], ["FSP", 3, 4, 2, 3], ["RE", 3, [0, 4, 1, 5, 2, 6, 3, 7]], ["CA", 2, 3, 5], ["CHR", 1, "shared", [2]], ["CA", 2, 3, 6], ["CHR", 0, "shared", [3]], ["CA", 1, 4, 6], ["FU", 5, [0, 1]], ["AN", 5, 0, 5], ["FU", 5, [1, 2]], ["AN", 5, 1, 4], ["FU", 5, [2, 3]], ["AN", 5, 2, 6], ["FU", 3, [0, 1]], ["SP", 3, 0, 32, [4], 1], ["AN", 3, 1, 2], ["FFSP", 3, 0, [2, 1], 1, 1], ["AN", 3, 1, 6], ["FU", 1, [0, 1]], ["SP", 1, 0, 4, [1], 1], ["AN", 1, 1, 2], ["FFSP", 1, 0, [2, 1], 1, 1], ["AN", 1, 1, 6], ["PR", 4, 0, "auto_unroll_max_step$1024"]]]], "r": [[0.000215532], 0, 4.25327, 1652873184], "v": "v0.6"}
{"i": [["[\"matmul\", 1024, 1024, 1, \"float32\"]", "cuda -keys=cuda,gpu -arch=sm_80 -max_num_threads=1024 -thread_warp_size=32", [-1, 16, 64, 49152, 2147483647, 1024, 8, 32], "", 0, []], [[], [["CHW", 2, "local"], ["SP", 2, 0, 1024, [2, 1, 16, 16], 1], ["SP", 2, 5, 1024, [1, 4, 1, 1], 1], ["SP", 2, 10, 1, [1, 1], 1], ["RE", 2, [0, 5, 1, 6, 2, 7, 10, 11, 3, 8, 12, 4, 9]], ["FSP", 3, 0, 1, 3], ["FSP", 3, 4, 2, 3], ["RE", 3, [0, 4, 1, 5, 2, 6, 3, 7]], ["CA", 2, 3, 5], ["CHR", 1, "shared", [2]], ["CA", 2, 3, 6], ["CHR", 0, "shared", [3]], ["CA", 1, 4, 6], ["FU", 5, [0, 1]], ["AN", 5, 0, 5], ["FU", 5, [1, 2]], ["AN", 5, 1, 4], ["FU", 5, [2, 3]], ["AN", 5, 2, 6], ["FU", 3, [0, 1]], ["SP", 3, 0, 1, [1], 1], ["AN", 3, 1, 2], ["FFSP", 3, 0, [2, 1], 1, 1], ["AN", 3, 1, 6], ["FU", 1, [0, 1]], ["SP", 1, 0, 256, [4], 1], ["AN", 1, 1, 2], ["FFSP", 1, 0, [2, 1], 1, 1], ["AN", 1, 1, 6], ["PR", 4, 0, "auto_unroll_max_step$512"]]]], "r": [[3.89724e-05], 0, 4.15317, 1652873185], "v": "v0.6"}
{"i": [["[\"matmul\", 1024, 1024, 1, \"float32\"]", "cuda -keys=cuda,gpu -arch=sm_80 -max_num_threads=1024 -thread_warp_size=32", [-1, 16, 64, 49152, 2147483647, 1024, 8, 32], "", 0, []], [[], [["CHW", 2, "local"], ["SP", 2, 0, 1024, [1, 512, 1, 2], 1], ["SP", 2, 5, 1024, [1, 1, 32, 1], 1], ["SP", 2, 10, 1, [1, 1], 1], ["RE", 2, [0, 5, 1, 6, 2, 7, 10, 11, 3, 8, 12, 4, 9]], ["FSP", 3, 0, 1, 3], ["FSP", 3, 4, 2, 3], ["RE", 3, [0, 4, 1, 5, 2, 6, 3, 7]], ["CA", 2, 3, 5], ["CHR", 1, "shared", [2]], ["CA", 2, 3, 6], ["CHR", 0, "shared", [3]], ["CA", 1, 4, 6], ["FU", 5, [0, 1]], ["AN", 5, 0, 5], ["FU", 5, [1, 2]], ["AN", 5, 1, 4], ["FU", 5, [2, 3]], ["AN", 5, 2, 6], ["FU", 3, [0, 1]], ["SP", 3, 0, 32, [4], 1], ["AN", 3, 1, 2], ["FFSP", 3, 0, [2, 1], 1, 1], ["AN", 3, 1, 6], ["FU", 1, [0, 1]], ["SP", 1, 0, 2, [1], 1], ["AN", 1, 1, 2], ["FFSP", 1, 0, [2, 1], 1, 1], ["AN", 1, 1, 6], ["PR", 4, 0, "auto_unroll_max_step$0"]]]], "r": [[4.95601e-05], 0, 1.82772, 1652873187], "v": "v0.6"}
{"i": [["[\"matmul\", 1024, 1024, 1, \"float32\"]", "cuda -keys=cuda,gpu -arch=sm_80 -max_num_threads=1024 -thread_warp_size=32", [-1, 16, 64, 49152, 2147483647, 1024, 8, 32], "", 0, []], [[], [["CHW", 2, "local"], ["SP", 2, 0, 1024, [1, 32, 1, 16], 1], ["SP", 2, 5, 1024, [8, 4, 8, 2], 1], ["SP", 2, 10, 1, [1, 1], 1], ["RE", 2, [0, 5, 1, 6, 2, 7, 10, 11, 3, 8, 12, 4, 9]], ["FSP", 3, 0, 1, 3], ["FSP", 3, 4, 2, 3], ["RE", 3, [0, 4, 1, 5, 2, 6, 3, 7]], ["CA", 2, 3, 5], ["CHR", 1, "shared", [2]], ["CA", 2, 3, 6], ["CHR", 0, "shared", [3]], ["CA", 1, 4, 6], ["FU", 5, [0, 1]], ["AN", 5, 0, 5], ["FU", 5, [1, 2]], ["AN", 5, 1, 4], ["FU", 5, [2, 3]], ["AN", 5, 2, 6], ["FU", 3, [0, 1]], ["SP", 3, 0, 64, [1], 1], ["AN", 3, 1, 2], ["FFSP", 3, 0, [2, 1], 1, 1], ["AN", 3, 1, 6], ["FU", 1, [0, 1]], ["SP", 1, 0, 16, [1], 1], ["AN", 1, 1, 2], ["FFSP", 1, 0, [2, 1], 1, 1], ["AN", 1, 1, 6], ["PR", 4, 0, "auto_unroll_max_step$64"]]]], "r": [[0.000333938], 0, 3.42753, 1652873188], "v": "v0.6"}
{"i": [["[\"matmul\", 1024, 1024, 1, \"float32\"]", "cuda -keys=cuda,gpu -arch=sm_80 -max_num_threads=1024 -thread_warp_size=32", [-1, 16, 64, 49152, 2147483647, 1024, 8, 32], "", 0, []], [[], [["CHW", 2, "local"], ["SP", 2, 0, 1024, [1, 4, 32, 8], 1], ["SP", 2, 5, 1024, [1, 32, 8, 4], 1], ["SP", 2, 10, 1, [1, 1], 1], ["RE", 2, [0, 5, 1, 6, 2, 7, 10, 11, 3, 8, 12, 4, 9]], ["FSP", 3, 0, 1, 3], ["FSP", 3, 4, 2, 3], ["RE", 3, [0, 4, 1, 5, 2, 6, 3, 7]], ["CA", 2, 3, 5], ["CHR", 1, "shared", [2]], ["CA", 2, 3, 6], ["CHR", 0, "shared", [3]], ["CA", 1, 4, 6], ["FU", 5, [0, 1]], ["AN", 5, 0, 5], ["FU", 5, [1, 2]], ["AN", 5, 1, 4], ["FU", 5, [2, 3]], ["AN", 5, 2, 6], ["FU", 3, [0, 1]], ["SP", 3, 0, 32, [1], 1], ["AN", 3, 1, 2], ["FFSP", 3, 0, [2, 1], 1, 1], ["AN", 3, 1, 6], ["FU", 1, [0, 1]], ["SP", 1, 0, 32, [1], 1], ["AN", 1, 1, 2], ["FFSP", 1, 0, [2, 1], 1, 1], ["AN", 1, 1, 6], ["PR", 4, 0, "auto_unroll_max_step$16"]]]], "r": [[0.00174419], 0, 2.38203, 1652873189], "v": "v0.6"}
{"i": [["[\"matmul\", 1024, 1024, 1, \"float32\"]", "cuda -keys=cuda,gpu -arch=sm_80 -max_num_threads=1024 -thread_warp_size=32", [-1, 16, 64, 49152, 2147483647, 1024, 8, 32], "", 0, []], [[], [["CHW", 2, "local"], ["SP", 2, 0, 1024, [1, 16, 4, 4], 1], ["SP", 2, 5, 1024, [8, 4, 32, 1], 1], ["SP", 2, 10, 1, [1, 1], 1], ["RE", 2, [0, 5, 1, 6, 2, 7, 10, 11, 3, 8, 12, 4, 9]], ["FSP", 3, 0, 1, 3], ["FSP", 3, 4, 2, 3], ["RE", 3, [0, 4, 1, 5, 2, 6, 3, 7]], ["CA", 2, 3, 5], ["CHR", 1, "shared", [2]], ["CA", 2, 3, 6], ["CHR", 0, "shared", [3]], ["CA", 1, 4, 6], ["FU", 5, [0, 1]], ["AN", 5, 0, 5], ["FU", 5, [1, 2]], ["AN", 5, 1, 4], ["FU", 5, [2, 3]], ["AN", 5, 2, 6], ["FU", 3, [0, 1]], ["SP", 3, 0, 32, [1], 1], ["AN", 3, 1, 2], ["FFSP", 3, 0, [2, 1], 1, 1], ["AN", 3, 1, 6], ["FU", 1, [0, 1]], ["SP", 1, 0, 16, [4], 1], ["AN", 1, 1, 2], ["FFSP", 1, 0, [2, 1], 1, 1], ["AN", 1, 1, 6], ["PR", 4, 0, "auto_unroll_max_step$64"]]]], "r": [[0.000473421], 0, 3.09176, 1652873190], "v": "v0.6"}
{"i": [["[\"matmul\", 1024, 1024, 1, \"float32\"]", "cuda -keys=cuda,gpu -arch=sm_80 -max_num_threads=1024 -thread_warp_size=32", [-1, 16, 64, 49152, 2147483647, 1024, 8, 32], "", 0, []], [[], [["CHW", 2, "local"], ["SP", 2, 0, 1024, [1, 64, 2, 1], 1], ["SP", 2, 5, 1024, [4, 8, 8, 1], 1], ["SP", 2, 10, 1, [1, 1], 1], ["RE", 2, [0, 5, 1, 6, 2, 7, 10, 11, 3, 8, 12, 4, 9]], ["FSP", 3, 0, 1, 3], ["FSP", 3, 4, 2, 3], ["RE", 3, [0, 4, 1, 5, 2, 6, 3, 7]], ["CA", 2, 3, 5], ["CHR", 1, "shared", [2]], ["CA", 2, 3, 6], ["CHR", 0, "shared", [3]], ["CA", 1, 4, 6], ["FU", 5, [0, 1]], ["AN", 5, 0, 5], ["FU", 5, [1, 2]], ["AN", 5, 1, 4], ["FU", 5, [2, 3]], ["AN", 5, 2, 6], ["FU", 3, [0, 1]], ["SP", 3, 0, 4, [1], 1], ["AN", 3, 1, 2], ["FFSP", 3, 0, [2, 1], 1, 1], ["AN", 3, 1, 6], ["FU", 1, [0, 1]], ["SP", 1, 0, 2, [1], 1], ["AN", 1, 1, 2], ["FFSP", 1, 0, [2, 1], 1, 1], ["AN", 1, 1, 6], ["PR", 4, 0, "auto_unroll_max_step$1024"]]]], "r": [[3.18621e-05], 0, 1.8822, 1652873191], "v": "v0.6"}
{"i": [["[\"matmul\", 1024, 1024, 1, \"float32\"]", "cuda -keys=cuda,gpu -arch=sm_80 -max_num_threads=1024 -thread_warp_size=32", [-1, 16, 64, 49152, 2147483647, 1024, 8, 32], "", 0, []], [[], [["CHW", 2, "local"], ["SP", 2, 0, 1024, [1, 32, 4, 2], 1], ["SP", 2, 5, 1024, [2, 8, 2, 1], 1], ["SP", 2, 10, 1, [1, 1], 1], ["RE", 2, [0, 5, 1, 6, 2, 7, 10, 11, 3, 8, 12, 4, 9]], ["FSP", 3, 0, 1, 3], ["FSP", 3, 4, 2, 3], ["RE", 3, [0, 4, 1, 5, 2, 6, 3, 7]], ["CA", 2, 3, 5], ["CHR", 1, "shared", [2]], ["CA", 2, 3, 6], ["CHR", 0, "shared", [3]], ["CA", 1, 4, 6], ["FU", 5, [0, 1]], ["AN", 5, 0, 5], ["FU", 5, [1, 2]], ["AN", 5, 1, 4], ["FU", 5, [2, 3]], ["AN", 5, 2, 6], ["FU", 3, [0, 1]], ["SP", 3, 0, 2, [2], 1], ["AN", 3, 1, 2], ["FFSP", 3, 0, [2, 1], 1, 1], ["AN", 3, 1, 6], ["FU", 1, [0, 1]], ["SP", 1, 0, 8, [1], 1], ["AN", 1, 1, 2], ["FFSP", 1, 0, [2, 1], 1, 1], ["AN", 1, 1, 6], ["PR", 4, 0, "auto_unroll_max_step$1024"]]]], "r": [[8.23416e-06], 0, 1.6314, 1652873192], "v": "v0.6"}
{"i": [["[\"matmul\", 1024, 1024, 1, \"float32\"]", "cuda -keys=cuda,gpu -arch=sm_80 -max_num_threads=1024 -thread_warp_size=32", [-1, 16, 64, 49152, 2147483647, 1024, 8, 32], "", 0, []], [[], [["CHW", 2, "local"], ["SP", 2, 0, 1024, [1, 64, 4, 4], 1], ["SP", 2, 5, 1024, [1, 16, 2, 2], 1], ["SP", 2, 10, 1, [1, 1], 1], ["RE", 2, [0, 5, 1, 6, 2, 7, 10, 11, 3, 8, 12, 4, 9]], ["FSP", 3, 0, 1, 3], ["FSP", 3, 4, 2, 3], ["RE", 3, [0, 4, 1, 5, 2, 6, 3, 7]], ["CA", 2, 3, 5], ["CHR", 1, "shared", [2]], ["CA", 2, 3, 6], ["CHR", 0, "shared", [3]], ["CA", 1, 4, 6], ["FU", 5, [0, 1]], ["AN", 5, 0, 5], ["FU", 5, [1, 2]], ["AN", 5, 1, 4], ["FU", 5, [2, 3]], ["AN", 5, 2, 6], ["FU", 3, [0, 1]], ["SP", 3, 0, 4, [1], 1], ["AN", 3, 1, 2], ["FFSP", 3, 0, [2, 1], 1, 1], ["AN", 3, 1, 6], ["FU", 1, [0, 1]], ["SP", 1, 0, 16, [1], 1], ["AN", 1, 1, 2], ["FFSP", 1, 0, [2, 1], 1, 1], ["AN", 1, 1, 6], ["PR", 4, 0, "auto_unroll_max_step$64"]]]], "r": [[3.14832e-05], 0, 1.77046, 1652873194], "v": "v0.6"}
{"i": [["[\"matmul\", 1024, 1024, 1, \"float32\"]", "cuda -keys=cuda,gpu -arch=sm_80 -max_num_threads=1024 -thread_warp_size=32", [-1, 16, 64, 49152, 2147483647, 1024, 8, 32], "", 0, []], [[], [["CHW", 2, "local"], ["SP", 2, 0, 1024, [1, 16, 16, 2], 1], ["SP", 2, 5, 1024, [8, 16, 1, 4], 1], ["SP", 2, 10, 1, [1, 1], 1], ["RE", 2, [0, 5, 1, 6, 2, 7, 10, 11, 3, 8, 12, 4, 9]], ["FSP", 3, 0, 1, 3], ["FSP", 3, 4, 2, 3], ["RE", 3, [0, 4, 1, 5, 2, 6, 3, 7]], ["CA", 2, 3, 5], ["CHR", 1, "shared", [2]], ["CA", 2, 3, 6], ["CHR", 0, "shared", [3]], ["CA", 1, 4, 6], ["FU", 5, [0, 1]], ["AN", 5, 0, 5], ["FU", 5, [1, 2]], ["AN", 5, 1, 4], ["FU", 5, [2, 3]], ["AN", 5, 2, 6], ["FU", 3, [0, 1]], ["SP", 3, 0, 4, [1], 1], ["AN", 3, 1, 2], ["FFSP", 3, 0, [2, 1], 1, 1], ["AN", 3, 1, 6], ["FU", 1, [0, 1]], ["SP", 1, 0, 32, [1], 1], ["AN", 1, 1, 2], ["FFSP", 1, 0, [2, 1], 1, 1], ["AN", 1, 1, 6], ["PR", 4, 0, "auto_unroll_max_step$1024"]]]], "r": [[0.000119348], 0, 7.10294, 1652873212], "v": "v0.6"}
{"i": [["[\"matmul\", 1024, 1024, 1, \"float32\"]", "cuda -keys=cuda,gpu -arch=sm_80 -max_num_threads=1024 -thread_warp_size=32", [-1, 16, 64, 49152, 2147483647, 1024, 8, 32], "", 0, []], [[], [["CHW", 2, "local"], ["SP", 2, 0, 1024, [1, 16, 2, 1], 1], ["SP", 2, 5, 1024, [1, 2, 128, 1], 1], ["SP", 2, 10, 1, [1, 1], 1], ["RE", 2, [0, 5, 1, 6, 2, 7, 10, 11, 3, 8, 12, 4, 9]], ["FSP", 3, 0, 1, 3], ["FSP", 3, 4, 2, 3], ["RE", 3, [0, 4, 1, 5, 2, 6, 3, 7]], ["CA", 2, 3, 5], ["CHR", 1, "shared", [2]], ["CA", 2, 3, 6], ["CHR", 0, "shared", [3]], ["CA", 1, 4, 6], ["FU", 5, [0, 1]], ["AN", 5, 0, 5], ["FU", 5, [1, 2]], ["AN", 5, 1, 4], ["FU", 5, [2, 3]], ["AN", 5, 2, 6], ["FU", 3, [0, 1]], ["SP", 3, 0, 8, [1], 1], ["AN", 3, 1, 2], ["FFSP", 3, 0, [2, 1], 1, 1], ["AN", 3, 1, 6], ["FU", 1, [0, 1]], ["SP", 1, 0, 2, [1], 1], ["AN", 1, 1, 2], ["FFSP", 1, 0, [2, 1], 1, 1], ["AN", 1, 1, 6], ["PR", 4, 0, "auto_unroll_max_step$512"]]]], "r": [[3.92277e-05], 0, 2.55166, 1652873213], "v": "v0.6"}
{"i": [["[\"matmul\", 1024, 1024, 1, \"float32\"]", "cuda -keys=cuda,gpu -arch=sm_80 -max_num_threads=1024 -thread_warp_size=32", [-1, 16, 64, 49152, 2147483647, 1024, 8, 32], "", 0, []], [[], [["CHW", 2, "local"], ["SP", 2, 0, 1024, [2, 8, 8, 4], 1], ["SP", 2, 5, 1024, [1, 4, 16, 2], 1], ["SP", 2, 10, 1, [1, 1], 1], ["RE", 2, [0, 5, 1, 6, 2, 7, 10, 11, 3, 8, 12, 4, 9]], ["FSP", 3, 0, 1, 3], ["FSP", 3, 4, 2, 3], ["RE", 3, [0, 4, 1, 5, 2, 6, 3, 7]], ["CA", 2, 3, 5], ["CHR", 1, "shared", [2]], ["CA", 2, 3, 6], ["CHR", 0, "shared", [3]], ["CA", 1, 4, 6], ["FU", 5, [0, 1]], ["AN", 5, 0, 5], ["FU", 5, [1, 2]], ["AN", 5, 1, 4], ["FU", 5, [2, 3]], ["AN", 5, 2, 6], ["FU", 3, [0, 1]], ["SP", 3, 0, 256, [1], 1], ["AN", 3, 1, 2], ["FFSP", 3, 0, [2, 1], 1, 1], ["AN", 3, 1, 6], ["FU", 1, [0, 1]], ["SP", 1, 0, 32, [1], 1], ["AN", 1, 1, 2], ["FFSP", 1, 0, [2, 1], 1, 1], ["AN", 1, 1, 6], ["PR", 4, 0, "auto_unroll_max_step$512"]]]], "r": [[0.000136103], 0, 6.61113, 1652873214], "v": "v0.6"}
{"i": [["[\"matmul\", 1024, 1024, 1, \"float32\"]", "cuda -keys=cuda,gpu -arch=sm_80 -max_num_threads=1024 -thread_warp_size=32", [-1, 16, 64, 49152, 2147483647, 1024, 8, 32], "", 0, []], [[], [["CHW", 2, "local"], ["SP", 2, 0, 1024, [1, 4, 32, 2], 1], ["SP", 2, 5, 1024, [1, 8, 1, 64], 1], ["SP", 2, 10, 1, [1, 1], 1], ["RE", 2, [0, 5, 1, 6, 2, 7, 10, 11, 3, 8, 12, 4, 9]], ["FSP", 3, 0, 1, 3], ["FSP", 3, 4, 2, 3], ["RE", 3, [0, 4, 1, 5, 2, 6, 3, 7]], ["CA", 2, 3, 5], ["CHR", 1, "shared", [2]], ["CA", 2, 3, 6], ["CHR", 0, "shared", [3]], ["CA", 1, 4, 6], ["FU", 5, [0, 1]], ["AN", 5, 0, 5], ["FU", 5, [1, 2]], ["AN", 5, 1, 4], ["FU", 5, [2, 3]], ["AN", 5, 2, 6], ["FU", 3, [0, 1]], ["SP", 3, 0, 64, [1], 1], ["AN", 3, 1, 2], ["FFSP", 3, 0, [2, 1], 1, 1], ["AN", 3, 1, 6], ["FU", 1, [0, 1]], ["SP", 1, 0, 64, [1], 1], ["AN", 1, 1, 2], ["FFSP", 1, 0, [2, 1], 1, 1], ["AN", 1, 1, 6], ["PR", 4, 0, "auto_unroll_max_step$512"]]]], "r": [[0.000264248], 0, 3.88496, 1652873215], "v": "v0.6"}
{"i": [["[\"matmul\", 1024, 1024, 1, \"float32\"]", "cuda -keys=cuda,gpu -arch=sm_80 -max_num_threads=1024 -thread_warp_size=32", [-1, 16, 64, 49152, 2147483647, 1024, 8, 32], "", 0, []], [[], [["CHW", 2, "local"], ["SP", 2, 0, 1024, [1, 4, 16, 8], 1], ["SP", 2, 5, 1024, [4, 8, 1, 2], 1], ["SP", 2, 10, 1, [1, 1], 1], ["RE", 2, [0, 5, 1, 6, 2, 7, 10, 11, 3, 8, 12, 4, 9]], ["FSP", 3, 0, 1, 3], ["FSP", 3, 4, 2, 3], ["RE", 3, [0, 4, 1, 5, 2, 6, 3, 7]], ["CA", 2, 3, 5], ["CHR", 1, "shared", [2]], ["CA", 2, 3, 6], ["CHR", 0, "shared", [3]], ["CA", 1, 4, 6], ["FU", 5, [0, 1]], ["AN", 5, 0, 5], ["FU", 5, [1, 2]], ["AN", 5, 1, 4], ["FU", 5, [2, 3]], ["AN", 5, 2, 6], ["FU", 3, [0, 1]], ["SP", 3, 0, 2, [1], 1], ["AN", 3, 1, 2], ["FFSP", 3, 0, [2, 1], 1, 1], ["AN", 3, 1, 6], ["FU", 1, [0, 1]], ["SP", 1, 0, 64, [1], 1], ["AN", 1, 1, 2], ["FFSP", 1, 0, [2, 1], 1, 1], ["AN", 1, 1, 6], ["PR", 4, 0, "auto_unroll_max_step$16"]]]], "r": [[2.59936e-05], 0, 2.04945, 1652873217], "v": "v0.6"}
{"i": [["[\"matmul\", 1024, 1024, 1, \"float32\"]", "cuda -keys=cuda,gpu -arch=sm_80 -max_num_threads=1024 -thread_warp_size=32", [-1, 16, 64, 49152, 2147483647, 1024, 8, 32], "", 0, []], [[], [["CHW", 2, "local"], ["SP", 2, 0, 1024, [1, 4, 2, 8], 1], ["SP", 2, 5, 1024, [1, 32, 1, 4], 1], ["SP", 2, 10, 1, [1, 1], 1], ["RE", 2, [0, 5, 1, 6, 2, 7, 10, 11, 3, 8, 12, 4, 9]], ["FSP", 3, 0, 1, 3], ["FSP", 3, 4, 2, 3], ["RE", 3, [0, 4, 1, 5, 2, 6, 3, 7]], ["CA", 2, 3, 5], ["CHR", 1, "shared", [2]], ["CA", 2, 3, 6], ["CHR", 0, "shared", [3]], ["CA", 1, 4, 6], ["FU", 5, [0, 1]], ["AN", 5, 0, 5], ["FU", 5, [1, 2]], ["AN", 5, 1, 4], ["FU", 5, [2, 3]], ["AN", 5, 2, 6], ["FU", 3, [0, 1]], ["SP", 3, 0, 16, [1], 1], ["AN", 3, 1, 2], ["FFSP", 3, 0, [2, 1], 1, 1], ["AN", 3, 1, 6], ["FU", 1, [0, 1]], ["SP", 1, 0, 16, [1], 1], ["AN", 1, 1, 2], ["FFSP", 1, 0, [2, 1], 1, 1], ["AN", 1, 1, 6], ["PR", 4, 0, "auto_unroll_max_step$64"]]]], "r": [[8.42779e-06], 0, 1.7567, 1652873218], "v": "v0.6"}
{"i": [["[\"matmul\", 1024, 1024, 1, \"float32\"]", "cuda -keys=cuda,gpu -arch=sm_80 -max_num_threads=1024 -thread_warp_size=32", [-1, 16, 64, 49152, 2147483647, 1024, 8, 32], "", 0, []], [[], [["CHW", 2, "local"], ["SP", 2, 0, 1024, [8, 4, 32, 1], 1], ["SP", 2, 5, 1024, [1, 8, 8, 2], 1], ["SP", 2, 10, 1, [1, 1], 1], ["RE", 2, [0, 5, 1, 6, 2, 7, 10, 11, 3, 8, 12, 4, 9]], ["FSP", 3, 0, 1, 3], ["FSP", 3, 4, 2, 3], ["RE", 3, [0, 4, 1, 5, 2, 6, 3, 7]], ["CA", 2, 3, 5], ["CHR", 1, "shared", [2]], ["CA", 2, 3, 6], ["CHR", 0, "shared", [3]], ["CA", 1, 4, 6], ["FU", 5, [0, 1]], ["AN", 5, 0, 5], ["FU", 5, [1, 2]], ["AN", 5, 1, 4], ["FU", 5, [2, 3]], ["AN", 5, 2, 6], ["FU", 3, [0, 1]], ["SP", 3, 0, 16, [1], 1], ["AN", 3, 1, 2], ["FFSP", 3, 0, [2, 1], 1, 1], ["AN", 3, 1, 6], ["FU", 1, [0, 1]], ["SP", 1, 0, 32, [1], 1], ["AN", 1, 1, 2], ["FFSP", 1, 0, [2, 1], 1, 1], ["AN", 1, 1, 6], ["PR", 4, 0, "auto_unroll_max_step$0"]]]], "r": [[0.000153123], 0, 2.58303, 1652873219], "v": "v0.6"}
{"i": [["[\"matmul\", 1024, 1024, 1, \"float32\"]", "cuda -keys=cuda,gpu -arch=sm_80 -max_num_threads=1024 -thread_warp_size=32", [-1, 16, 64, 49152, 2147483647, 1024, 8, 32], "", 0, []], [[], [["CHW", 2, "local"], ["SP", 2, 0, 1024, [1, 128, 1, 8], 1], ["SP", 2, 5, 1024, [1, 4, 64, 4], 1], ["SP", 2, 10, 1, [1, 1], 1], ["RE", 2, [0, 5, 1, 6, 2, 7, 10, 11, 3, 8, 12, 4, 9]], ["FSP", 3, 0, 1, 3], ["FSP", 3, 4, 2, 3], ["RE", 3, [0, 4, 1, 5, 2, 6, 3, 7]], ["CA", 2, 3, 5], ["CHR", 1, "shared", [2]], ["CA", 2, 3, 6], ["CHR", 0, "shared", [3]], ["CA", 1, 4, 6], ["FU", 5, [0, 1]], ["AN", 5, 0, 5], ["FU", 5, [1, 2]], ["AN", 5, 1, 4], ["FU", 5, [2, 3]], ["AN", 5, 2, 6], ["FU", 3, [0, 1]], ["SP", 3, 0, 128, [4], 1], ["AN", 3, 1, 2], ["FFSP", 3, 0, [2, 1], 1, 1], ["AN", 3, 1, 6], ["FU", 1, [0, 1]], ["SP", 1, 0, 8, [1], 1], ["AN", 1, 1, 2], ["FFSP", 1, 0, [2, 1], 1, 1], ["AN", 1, 1, 6], ["PR", 4, 0, "auto_unroll_max_step$16"]]]], "r": [[0.0017309], 0, 2.30302, 1652873220], "v": "v0.6"}
{"i": [["[\"matmul\", 1024, 1024, 1, \"float32\"]", "cuda -keys=cuda,gpu -arch=sm_80 -max_num_threads=1024 -thread_warp_size=32", [-1, 16, 64, 49152, 2147483647, 1024, 8, 32], "", 0, []], [[], [["CHW", 2, "local"], ["SP", 2, 0, 1024, [4, 8, 2, 1], 1], ["SP", 2, 5, 1024, [1, 4, 1, 64], 1], ["SP", 2, 10, 1, [1, 1], 1], ["RE", 2, [0, 5, 1, 6, 2, 7, 10, 11, 3, 8, 12, 4, 9]], ["FSP", 3, 0, 1, 3], ["FSP", 3, 4, 2, 3], ["RE", 3, [0, 4, 1, 5, 2, 6, 3, 7]], ["CA", 2, 3, 5], ["CHR", 1, "shared", [2]], ["CA", 2, 3, 6], ["CHR", 0, "shared", [3]], ["CA", 1, 4, 6], ["FU", 5, [0, 1]], ["AN", 5, 0, 5], ["FU", 5, [1, 2]], ["AN", 5, 1, 4], ["FU", 5, [2, 3]], ["AN", 5, 2, 6], ["FU", 3, [0, 1]], ["SP", 3, 0, 64, [1], 1], ["AN", 3, 1, 2], ["FFSP", 3, 0, [2, 1], 1, 1], ["AN", 3, 1, 6], ["FU", 1, [0, 1]], ["SP", 1, 0, 2, [1], 1], ["AN", 1, 1, 2], ["FFSP", 1, 0, [2, 1], 1, 1], ["AN", 1, 1, 6], ["PR", 4, 0, "auto_unroll_max_step$64"]]]], "r": [[3.76012e-05], 0, 3.77906, 1652873221], "v": "v0.6"}
{"i": [["[\"matmul\", 1024, 1024, 1, \"float32\"]", "cuda -keys=cuda,gpu -arch=sm_80 -max_num_threads=1024 -thread_warp_size=32", [-1, 16, 64, 49152, 2147483647, 1024, 8, 32], "", 0, []], [[], [["CHW", 2, "local"], ["SP", 2, 0, 1024, [2, 32, 1, 16], 1], ["SP", 2, 5, 1024, [1, 4, 1, 32], 1], ["SP", 2, 10, 1, [1, 1], 1], ["RE", 2, [0, 5, 1, 6, 2, 7, 10, 11, 3, 8, 12, 4, 9]], ["FSP", 3, 0, 1, 3], ["FSP", 3, 4, 2, 3], ["RE", 3, [0, 4, 1, 5, 2, 6, 3, 7]], ["CA", 2, 3, 5], ["CHR", 1, "shared", [2]], ["CA", 2, 3, 6], ["CHR", 0, "shared", [3]], ["CA", 1, 4, 6], ["FU", 5, [0, 1]], ["AN", 5, 0, 5], ["FU", 5, [1, 2]], ["AN", 5, 1, 4], ["FU", 5, [2, 3]], ["AN", 5, 2, 6], ["FU", 3, [0, 1]], ["SP", 3, 0, 8, [1], 1], ["AN", 3, 1, 2], ["FFSP", 3, 0, [2, 1], 1, 1], ["AN", 3, 1, 6], ["FU", 1, [0, 1]], ["SP", 1, 0, 16, [1], 1], ["AN", 1, 1, 2], ["FFSP", 1, 0, [2, 1], 1, 1], ["AN", 1, 1, 6], ["PR", 4, 0, "auto_unroll_max_step$16"]]]], "r": [[0.00022044], 0, 2.15923, 1652873222], "v": "v0.6"}
{"i": [["[\"matmul\", 1024, 1024, 1, \"float32\"]", "cuda -keys=cuda,gpu -arch=sm_80 -max_num_threads=1024 -thread_warp_size=32", [-1, 16, 64, 49152, 2147483647, 1024, 8, 32], "", 0, []], [[], [["CHW", 2, "local"], ["SP", 2, 0, 1024, [1, 4, 4, 64], 1], ["SP", 2, 5, 1024, [2, 32, 1, 2], 1], ["SP", 2, 10, 1, [1, 1], 1], ["RE", 2, [0, 5, 1, 6, 2, 7, 10, 11, 3, 8, 12, 4, 9]], ["FSP", 3, 0, 1, 3], ["FSP", 3, 4, 2, 3], ["RE", 3, [0, 4, 1, 5, 2, 6, 3, 7]], ["CA", 2, 3, 5], ["CHR", 1, "shared", [2]], ["CA", 2, 3, 6], ["CHR", 0, "shared", [3]], ["CA", 1, 4, 6], ["FU", 5, [0, 1]], ["AN", 5, 0, 5], ["FU", 5, [1, 2]], ["AN", 5, 1, 4], ["FU", 5, [2, 3]], ["AN", 5, 2, 6], ["FU", 3, [0, 1]], ["SP", 3, 0, 4, [1], 1], ["AN", 3, 1, 2], ["FFSP", 3, 0, [2, 1], 1, 1], ["AN", 3, 1, 6], ["FU", 1, [0, 1]], ["SP", 1, 0, 256, [1], 1], ["AN", 1, 1, 2], ["FFSP", 1, 0, [2, 1], 1, 1], ["AN", 1, 1, 6], ["PR", 4, 0, "auto_unroll_max_step$16"]]]], "r": [[4.83045e-05], 0, 3.14417, 1652873224], "v": "v0.6"}
{"i": [["[\"matmul\", 1024, 1024, 1, \"float32\"]", "cuda -keys=cuda,gpu -arch=sm_80 -max_num_threads=1024 -thread_warp_size=32", [-1, 16, 64, 49152, 2147483647, 1024, 8, 32], "", 0, []], [[], [["CHW", 2, "local"], ["SP", 2, 0, 1024, [1, 32, 1, 16], 1], ["SP", 2, 5, 1024, [4, 4, 2, 8], 1], ["SP", 2, 10, 1, [1, 1], 1], ["RE", 2, [0, 5, 1, 6, 2, 7, 10, 11, 3, 8, 12, 4, 9]], ["FSP", 3, 0, 1, 3], ["FSP", 3, 4, 2, 3], ["RE", 3, [0, 4, 1, 5, 2, 6, 3, 7]], ["CA", 2, 3, 5], ["CHR", 1, "shared", [2]], ["CA", 2, 3, 6], ["CHR", 0, "shared", [3]], ["CA", 1, 4, 6], ["FU", 5, [0, 1]], ["AN", 5, 0, 5], ["FU", 5, [1, 2]], ["AN", 5, 1, 4], ["FU", 5, [2, 3]], ["AN", 5, 2, 6], ["FU", 3, [0, 1]], ["SP", 3, 0, 8, [1], 1], ["AN", 3, 1, 2], ["FFSP", 3, 0, [2, 1], 1, 1], ["AN", 3, 1, 6], ["FU", 1, [0, 1]], ["SP", 1, 0, 16, [1], 1], ["AN", 1, 1, 2], ["FFSP", 1, 0, [2, 1], 1, 1], ["AN", 1, 1, 6], ["PR", 4, 0, "auto_unroll_max_step$16"]]]], "r": [[0.0001594], 0, 3.29203, 1652873225], "v": "v0.6"}
{"i": [["[\"matmul\", 1024, 1024, 1, \"float32\"]", "cuda -keys=cuda,gpu -arch=sm_80 -max_num_threads=1024 -thread_warp_size=32", [-1, 16, 64, 49152, 2147483647, 1024, 8, 32], "", 0, []], [[], [["CHW", 2, "local"], ["SP", 2, 0, 1024, [1, 4, 2, 4], 1], ["SP", 2, 5, 1024, [1, 16, 8, 2], 1], ["SP", 2, 10, 1, [1, 1], 1], ["RE", 2, [0, 5, 1, 6, 2, 7, 10, 11, 3, 8, 12, 4, 9]], ["FSP", 3, 0, 1, 3], ["FSP", 3, 4, 2, 3], ["RE", 3, [0, 4, 1, 5, 2, 6, 3, 7]], ["CA", 2, 3, 5], ["CHR", 1, "shared", [2]], ["CA", 2, 3, 6], ["CHR", 0, "shared", [3]], ["CA", 1, 4, 6], ["FU", 5, [0, 1]], ["AN", 5, 0, 5], ["FU", 5, [1, 2]], ["AN", 5, 1, 4], ["FU", 5, [2, 3]], ["AN", 5, 2, 6], ["FU", 3, [0, 1]], ["SP", 3, 0, 16, [1], 1], ["AN", 3, 1, 2], ["FFSP", 3, 0, [2, 1], 1, 1], ["AN", 3, 1, 6], ["FU", 1, [0, 1]], ["SP", 1, 0, 8, [1], 1], ["AN", 1, 1, 2], ["FFSP", 1, 0, [2, 1], 1, 1], ["AN", 1, 1, 6], ["PR", 4, 0, "auto_unroll_max_step$16"]]]], "r": [[2.956e-05], 0, 1.8756, 1652873227], "v": "v0.6"}
{"i": [["[\"matmul\", 1024, 1024, 1, \"float32\"]", "cuda -keys=cuda,gpu -arch=sm_80 -max_num_threads=1024 -thread_warp_size=32", [-1, 16, 64, 49152, 2147483647, 1024, 8, 32], "", 0, []], [[], [["CHW", 2, "local"], ["SP", 2, 0, 1024, [1, 16, 1, 2], 1], ["SP", 2, 5, 1024, [4, 32, 4, 1], 1], ["SP", 2, 10, 1, [1, 1], 1], ["RE", 2, [0, 5, 1, 6, 2, 7, 10, 11, 3, 8, 12, 4, 9]], ["FSP", 3, 0, 1, 3], ["FSP", 3, 4, 2, 3], ["RE", 3, [0, 4, 1, 5, 2, 6, 3, 7]], ["CA", 2, 3, 5], ["CHR", 1, "shared", [2]], ["CA", 2, 3, 6], ["CHR", 0, "shared", [3]], ["CA", 1, 4, 6], ["FU", 5, [0, 1]], ["AN", 5, 0, 5], ["FU", 5, [1, 2]], ["AN", 5, 1, 4], ["FU", 5, [2, 3]], ["AN", 5, 2, 6], ["FU", 3, [0, 1]], ["SP", 3, 0, 16, [1], 1], ["AN", 3, 1, 2], ["FFSP", 3, 0, [2, 1], 1, 1], ["AN", 3, 1, 6], ["FU", 1, [0, 1]], ["SP", 1, 0, 2, [2], 1], ["AN", 1, 1, 2], ["FFSP", 1, 0, [2, 1], 1, 1], ["AN", 1, 1, 6], ["PR", 4, 0, "auto_unroll_max_step$512"]]]], "r": [[1.15048e-05], 0, 1.69316, 1652873228], "v": "v0.6"}
{"i": [["[\"matmul\", 1024, 1024, 1, \"float32\"]", "cuda -keys=cuda,gpu -arch=sm_80 -max_num_threads=1024 -thread_warp_size=32", [-1, 16, 64, 49152, 2147483647, 1024, 8, 32], "", 0, []], [[], [["CHW", 2, "local"], ["SP", 2, 0, 1024, [1, 1, 4, 1], 1], ["SP", 2, 5, 1024, [8, 4, 1, 8], 1], ["SP", 2, 10, 1, [1, 1], 1], ["RE", 2, [0, 5, 1, 6, 2, 7, 10, 11, 3, 8, 12, 4, 9]], ["FSP", 3, 0, 1, 3], ["FSP", 3, 4, 2, 3], ["RE", 3, [0, 4, 1, 5, 2, 6, 3, 7]], ["CA", 2, 3, 5], ["CHR", 1, "shared", [2]], ["CA", 2, 3, 6], ["CHR", 0, "shared", [3]], ["CA", 1, 4, 6], ["FU", 5, [0, 1]], ["AN", 5, 0, 5], ["FU", 5, [1, 2]], ["AN", 5, 1, 4], ["FU", 5, [2, 3]], ["AN", 5, 2, 6], ["FU", 3, [0, 1]], ["SP", 3, 0, 2, [1], 1], ["AN", 3, 1, 2], ["FFSP", 3, 0, [2, 1], 1, 1], ["AN", 3, 1, 6], ["FU", 1, [0, 1]], ["SP", 1, 0, 4, [4], 1], ["AN", 1, 1, 2], ["FFSP", 1, 0, [2, 1], 1, 1], ["AN", 1, 1, 6], ["PR", 4, 0, "auto_unroll_max_step$1024"]]]], "r": [[1.59539e-05], 0, 2.5378, 1652873229], "v": "v0.6"}
{"i": [["[\"matmul\", 1024, 1024, 1, \"float32\"]", "cuda -keys=cuda,gpu -arch=sm_80 -max_num_threads=1024 -thread_warp_size=32", [-1, 16, 64, 49152, 2147483647, 1024, 8, 32], "", 0, []], [[], [["CHW", 2, "local"], ["SP", 2, 0, 1024, [1, 1, 2, 16], 1], ["SP", 2, 5, 1024, [4, 32, 1, 1], 1], ["SP", 2, 10, 1, [1, 1], 1], ["RE", 2, [0, 5, 1, 6, 2, 7, 10, 11, 3, 8, 12, 4, 9]], ["FSP", 3, 0, 1, 3], ["FSP", 3, 4, 2, 3], ["RE", 3, [0, 4, 1, 5, 2, 6, 3, 7]], ["CA", 2, 3, 5], ["CHR", 1, "shared", [2]], ["CA", 2, 3, 6], ["CHR", 0, "shared", [3]], ["CA", 1, 4, 6], ["FU", 5, [0, 1]], ["AN", 5, 0, 5], ["FU", 5, [1, 2]], ["AN", 5, 1, 4], ["FU", 5, [2, 3]], ["AN", 5, 2, 6], ["FU", 3, [0, 1]], ["SP", 3, 0, 1, [1], 1], ["AN", 3, 1, 2], ["FFSP", 3, 0, [2, 1], 1, 1], ["AN", 3, 1, 6], ["FU", 1, [0, 1]], ["SP", 1, 0, 64, [1], 1], ["AN", 1, 1, 2], ["FFSP", 1, 0, [2, 1], 1, 1], ["AN", 1, 1, 6], ["PR", 4, 0, "auto_unroll_max_step$0"]]]], "r": [[4.50649e-06], 0, 1.57899, 1652873230], "v": "v0.6"}
{"i": [["[\"matmul\", 1024, 1024, 1, \"float32\"]", "cuda -keys=cuda,gpu -arch=sm_80 -max_num_threads=1024 -thread_warp_size=32", [-1, 16, 64, 49152, 2147483647, 1024, 8, 32], "", 0, []], [[], [["CHW", 2, "local"], ["SP", 2, 0, 1024, [1, 8, 2, 2], 1], ["SP", 2, 5, 1024, [4, 64, 2, 2], 1], ["SP", 2, 10, 1, [1, 1], 1], ["RE", 2, [0, 5, 1, 6, 2, 7, 10, 11, 3, 8, 12, 4, 9]], ["FSP", 3, 0, 1, 3], ["FSP", 3, 4, 2, 3], ["RE", 3, [0, 4, 1, 5, 2, 6, 3, 7]], ["CA", 2, 3, 5], ["CHR", 1, "shared", [2]], ["CA", 2, 3, 6], ["CHR", 0, "shared", [3]], ["CA", 1, 4, 6], ["FU", 5, [0, 1]], ["AN", 5, 0, 5], ["FU", 5, [1, 2]], ["AN", 5, 1, 4], ["FU", 5, [2, 3]], ["AN", 5, 2, 6], ["FU", 3, [0, 1]], ["SP", 3, 0, 4, [1], 1], ["AN", 3, 1, 2], ["FFSP", 3, 0, [2, 1], 1, 1], ["AN", 3, 1, 6], ["FU", 1, [0, 1]], ["SP", 1, 0, 2, [1], 1], ["AN", 1, 1, 2], ["FFSP", 1, 0, [2, 1], 1, 1], ["AN", 1, 1, 6], ["PR", 4, 0, "auto_unroll_max_step$1024"]]]], "r": [[1.73958e-05], 0, 1.77645, 1652873231], "v": "v0.6"}
{"i": [["[\"matmul\", 1024, 1024, 1, \"float32\"]", "cuda -keys=cuda,gpu -arch=sm_80 -max_num_threads=1024 -thread_warp_size=32", [-1, 16, 64, 49152, 2147483647, 1024, 8, 32], "", 0, []], [[], [["CHW", 2, "local"], ["SP", 2, 0, 1024, [1, 32, 4, 2], 1], ["SP", 2, 5, 1024, [2, 4, 4, 1], 1], ["SP", 2, 10, 1, [1, 1], 1], ["RE", 2, [0, 5, 1, 6, 2, 7, 10, 11, 3, 8, 12, 4, 9]], ["FSP", 3, 0, 1, 3], ["FSP", 3, 4, 2, 3], ["RE", 3, [0, 4, 1, 5, 2, 6, 3, 7]], ["CA", 2, 3, 5], ["CHR", 1, "shared", [2]], ["CA", 2, 3, 6], ["CHR", 0, "shared", [3]], ["CA", 1, 4, 6], ["FU", 5, [0, 1]], ["AN", 5, 0, 5], ["FU", 5, [1, 2]], ["AN", 5, 1, 4], ["FU", 5, [2, 3]], ["AN", 5, 2, 6], ["FU", 3, [0, 1]], ["SP", 3, 0, 2, [2], 1], ["AN", 3, 1, 2], ["FFSP", 3, 0, [2, 1], 1, 1], ["AN", 3, 1, 6], ["FU", 1, [0, 1]], ["SP", 1, 0, 8, [2], 1], ["AN", 1, 1, 2], ["FFSP", 1, 0, [2, 1], 1, 1], ["AN", 1, 1, 6], ["PR", 4, 0, "auto_unroll_max_step$1024"]]]], "r": [[1.51159e-05], 0, 1.76583, 1652873232], "v": "v0.6"}
{"i": [["[\"matmul\", 1024, 1024, 1, \"float32\"]", "cuda -keys=cuda,gpu -arch=sm_80 -max_num_threads=1024 -thread_warp_size=32", [-1, 16, 64, 49152, 2147483647, 1024, 8, 32], "", 0, []], [[], [["CHW", 2, "local"], ["SP", 2, 0, 1024, [1, 16, 4, 1], 1], ["SP", 2, 5, 1024, [2, 8, 1, 1], 1], ["SP", 2, 10, 1, [1, 1], 1], ["RE", 2, [0, 5, 1, 6, 2, 7, 10, 11, 3, 8, 12, 4, 9]], ["FSP", 3, 0, 1, 3], ["FSP", 3, 4, 2, 3], ["RE", 3, [0, 4, 1, 5, 2, 6, 3, 7]], ["CA", 2, 3, 5], ["CHR", 1, "shared", [2]], ["CA", 2, 3, 6], ["CHR", 0, "shared", [3]], ["CA", 1, 4, 6], ["FU", 5, [0, 1]], ["AN", 5, 0, 5], ["FU", 5, [1, 2]], ["AN", 5, 1, 4], ["FU", 5, [2, 3]], ["AN", 5, 2, 6], ["FU", 3, [0, 1]], ["SP", 3, 0, 1, [1], 1], ["AN", 3, 1, 2], ["FFSP", 3, 0, [2, 1], 1, 1], ["AN", 3, 1, 6], ["FU", 1, [0, 1]], ["SP", 1, 0, 4, [1], 1], ["AN", 1, 1, 2], ["FFSP", 1, 0, [2, 1], 1, 1], ["AN", 1, 1, 6], ["PR", 4, 0, "auto_unroll_max_step$512"]]]], "r": [[4.43212e-06], 0, 1.47294, 1652873233], "v": "v0.6"}
{"i": [["[\"matmul\", 1024, 1024, 1, \"float32\"]", "cuda -keys=cuda,gpu -arch=sm_80 -max_num_threads=1024 -thread_warp_size=32", [-1, 16, 64, 49152, 2147483647, 1024, 8, 32], "", 0, []], [[], [["CHW", 2, "local"], ["SP", 2, 0, 1024, [1, 4, 128, 1], 1], ["SP", 2, 5, 1024, [1, 32, 2, 1], 1], ["SP", 2, 10, 1, [1, 1], 1], ["RE", 2, [0, 5, 1, 6, 2, 7, 10, 11, 3, 8, 12, 4, 9]], ["FSP", 3, 0, 1, 3], ["FSP", 3, 4, 2, 3], ["RE", 3, [0, 4, 1, 5, 2, 6, 3, 7]], ["CA", 2, 3, 5], ["CHR", 1, "shared", [2]], ["CA", 2, 3, 6], ["CHR", 0, "shared", [3]], ["CA", 1, 4, 6], ["FU", 5, [0, 1]], ["AN", 5, 0, 5], ["FU", 5, [1, 2]], ["AN", 5, 1, 4], ["FU", 5, [2, 3]], ["AN", 5, 2, 6], ["FU", 3, [0, 1]], ["SP", 3, 0, 4, [1], 1], ["AN", 3, 1, 2], ["FFSP", 3, 0, [2, 1], 1, 1], ["AN", 3, 1, 6], ["FU", 1, [0, 1]], ["SP", 1, 0, 128, [1], 1], ["AN", 1, 1, 2], ["FFSP", 1, 0, [2, 1], 1, 1], ["AN", 1, 1, 6], ["PR", 4, 0, "auto_unroll_max_step$512"]]]], "r": [[6.44451e-06], 0, 2.00179, 1652873234], "v": "v0.6"}
{"i": [["[\"matmul\", 1024, 1024, 1, \"float32\"]", "cuda -keys=cuda,gpu -arch=sm_80 -max_num_threads=1024 -thread_warp_size=32", [-1, 16, 64, 49152, 2147483647, 1024, 8, 32], "", 0, []], [[], [["CHW", 2, "local"], ["SP", 2, 0, 1024, [4, 32, 4, 2], 1], ["SP", 2, 5, 1024, [1, 1, 512, 1], 1], ["SP", 2, 10, 1, [1, 1], 1], ["RE", 2, [0, 5, 1, 6, 2, 7, 10, 11, 3, 8, 12, 4, 9]], ["FSP", 3, 0, 1, 3], ["FSP", 3, 4, 2, 3], ["RE", 3, [0, 4, 1, 5, 2, 6, 3, 7]], ["CA", 2, 3, 5], ["CHR", 1, "shared", [2]], ["CA", 2, 3, 6], ["CHR", 0, "shared", [3]], ["CA", 1, 4, 6], ["FU", 5, [0, 1]], ["AN", 5, 0, 5], ["FU", 5, [1, 2]], ["AN", 5, 1, 4], ["FU", 5, [2, 3]], ["AN", 5, 2, 6], ["FU", 3, [0, 1]], ["SP", 3, 0, 512, [1], 1], ["AN", 3, 1, 2], ["FFSP", 3, 0, [2, 1], 1, 1], ["AN", 3, 1, 6], ["FU", 1, [0, 1]], ["SP", 1, 0, 8, [1], 1], ["AN", 1, 1, 2], ["FFSP", 1, 0, [2, 1], 1, 1], ["AN", 1, 1, 6], ["PR", 4, 0, "auto_unroll_max_step$512"]]]], "r": [[0.000983], 0, 2.59066, 1652873236], "v": "v0.6"}
{"i": [["[\"matmul\", 1024, 1024, 1, \"float32\"]", "cuda -keys=cuda,gpu -arch=sm_80 -max_num_threads=1024 -thread_warp_size=32", [-1, 16, 64, 49152, 2147483647, 1024, 8, 32], "", 0, []], [[], [["CHW", 2, "local"], ["SP", 2, 0, 1024, [2, 64, 1, 4], 1], ["SP", 2, 5, 1024, [4, 1, 64, 2], 1], ["SP", 2, 10, 1, [1, 1], 1], ["RE", 2, [0, 5, 1, 6, 2, 7, 10, 11, 3, 8, 12, 4, 9]], ["FSP", 3, 0, 1, 3], ["FSP", 3, 4, 2, 3], ["RE", 3, [0, 4, 1, 5, 2, 6, 3, 7]], ["CA", 2, 3, 5], ["CHR", 1, "shared", [2]], ["CA", 2, 3, 6], ["CHR", 0, "shared", [3]], ["CA", 1, 4, 6], ["FU", 5, [0, 1]], ["AN", 5, 0, 5], ["FU", 5, [1, 2]], ["AN", 5, 1, 4], ["FU", 5, [2, 3]], ["AN", 5, 2, 6], ["FU", 3, [0, 1]], ["SP", 3, 0, 128, [1], 1], ["AN", 3, 1, 2], ["FFSP", 3, 0, [2, 1], 1, 1], ["AN", 3, 1, 6], ["FU", 1, [0, 1]], ["SP", 1, 0, 4, [1], 1], ["AN", 1, 1, 2], ["FFSP", 1, 0, [2, 1], 1, 1], ["AN", 1, 1, 6], ["PR", 4, 0, "auto_unroll_max_step$64"]]]], "r": [[0.000473484], 0, 2.17926, 1652873253], "v": "v0.6"}
{"i": [["[\"matmul\", 1024, 1024, 1, \"float32\"]", "cuda -keys=cuda,gpu -arch=sm_80 -max_num_threads=1024 -thread_warp_size=32", [-1, 16, 64, 49152, 2147483647, 1024, 8, 32], "", 0, []], [[], [["CHW", 2, "local"], ["SP", 2, 0, 1024, [4, 2, 1, 4], 1], ["SP", 2, 5, 1024, [2, 2, 8, 8], 1], ["SP", 2, 10, 1, [1, 1], 1], ["RE", 2, [0, 5, 1, 6, 2, 7, 10, 11, 3, 8, 12, 4, 9]], ["FSP", 3, 0, 1, 3], ["FSP", 3, 4, 2, 3], ["RE", 3, [0, 4, 1, 5, 2, 6, 3, 7]], ["CA", 2, 3, 5], ["CHR", 1, "shared", [2]], ["CA", 2, 3, 6], ["CHR", 0, "shared", [3]], ["CA", 1, 4, 6], ["FU", 5, [0, 1]], ["AN", 5, 0, 5], ["FU", 5, [1, 2]], ["AN", 5, 1, 4], ["FU", 5, [2, 3]], ["AN", 5, 2, 6], ["FU", 3, [0, 1]], ["SP", 3, 0, 8, [1], 1], ["AN", 3, 1, 2], ["FFSP", 3, 0, [2, 1], 1, 1], ["AN", 3, 1, 6], ["FU", 1, [0, 1]], ["SP", 1, 0, 4, [1], 1], ["AN", 1, 1, 2], ["FFSP", 1, 0, [2, 1], 1, 1], ["AN", 1, 1, 6], ["PR", 4, 0, "auto_unroll_max_step$64"]]]], "r": [[0.000120221], 0, 3.72815, 1652873255], "v": "v0.6"}
{"i": [["[\"matmul\", 1024, 1024, 1, \"float32\"]", "cuda -keys=cuda,gpu -arch=sm_80 -max_num_threads=1024 -thread_warp_size=32", [-1, 16, 64, 49152, 2147483647, 1024, 8, 32], "", 0, []], [[], [["CHW", 2, "local"], ["SP", 2, 0, 1024, [1, 32, 1, 16], 1], ["SP", 2, 5, 1024, [4, 4, 1, 8], 1], ["SP", 2, 10, 1, [1, 1], 1], ["RE", 2, [0, 5, 1, 6, 2, 7, 10, 11, 3, 8, 12, 4, 9]], ["FSP", 3, 0, 1, 3], ["FSP", 3, 4, 2, 3], ["RE", 3, [0, 4, 1, 5, 2, 6, 3, 7]], ["CA", 2, 3, 5], ["CHR", 1, "shared", [2]], ["CA", 2, 3, 6], ["CHR", 0, "shared", [3]], ["CA", 1, 4, 6], ["FU", 5, [0, 1]], ["AN", 5, 0, 5], ["FU", 5, [1, 2]], ["AN", 5, 1, 4], ["FU", 5, [2, 3]], ["AN", 5, 2, 6], ["FU", 3, [0, 1]], ["SP", 3, 0, 8, [1], 1], ["AN", 3, 1, 2], ["FFSP", 3, 0, [2, 1], 1, 1], ["AN", 3, 1, 6], ["FU", 1, [0, 1]], ["SP", 1, 0, 16, [4], 1], ["AN", 1, 1, 2], ["FFSP", 1, 0, [2, 1], 1, 1], ["AN", 1, 1, 6], ["PR", 4, 0, "auto_unroll_max_step$16"]]]], "r": [[4.95837e-05], 0, 2.19409, 1652873256], "v": "v0.6"}
{"i": [["[\"matmul\", 1024, 1024, 1, \"float32\"]", "cuda -keys=cuda,gpu -arch=sm_80 -max_num_threads=1024 -thread_warp_size=32", [-1, 16, 64, 49152, 2147483647, 1024, 8, 32], "", 0, []], [[], [["CHW", 2, "local"], ["SP", 2, 0, 1024, [1, 64, 4, 1], 1], ["SP", 2, 5, 1024, [8, 2, 1, 32], 1], ["SP", 2, 10, 1, [1, 1], 1], ["RE", 2, [0, 5, 1, 6, 2, 7, 10, 11, 3, 8, 12, 4, 9]], ["FSP", 3, 0, 1, 3], ["FSP", 3, 4, 2, 3], ["RE", 3, [0, 4, 1, 5, 2, 6, 3, 7]], ["CA", 2, 3, 5], ["CHR", 1, "shared", [2]], ["CA", 2, 3, 6], ["CHR", 0, "shared", [3]], ["CA", 1, 4, 6], ["FU", 5, [0, 1]], ["AN", 5, 0, 5], ["FU", 5, [1, 2]], ["AN", 5, 1, 4], ["FU", 5, [2, 3]], ["AN", 5, 2, 6], ["FU", 3, [0, 1]], ["SP", 3, 0, 64, [1], 1], ["AN", 3, 1, 2], ["FFSP", 3, 0, [2, 1], 1, 1], ["AN", 3, 1, 6], ["FU", 1, [0, 1]], ["SP", 1, 0, 4, [2], 1], ["AN", 1, 1, 2], ["FFSP", 1, 0, [2, 1], 1, 1], ["AN", 1, 1, 6], ["PR", 4, 0, "auto_unroll_max_step$16"]]]], "r": [[0.000225284], 0, 4.29659, 1652873257], "v": "v0.6"}
{"i": [["[\"matmul\", 1024, 1024, 1, \"float32\"]", "cuda -keys=cuda,gpu -arch=sm_80 -max_num_threads=1024 -thread_warp_size=32", [-1, 16, 64, 49152, 2147483647, 1024, 8, 32], "", 0, []], [[], [["CHW", 2, "local"], ["SP", 2, 0, 1024, [1, 8, 8, 4], 1], ["SP", 2, 5, 1024, [8, 8, 8, 1], 1], ["SP", 2, 10, 1, [1, 1], 1], ["RE", 2, [0, 5, 1, 6, 2, 7, 10, 11, 3, 8, 12, 4, 9]], ["FSP", 3, 0, 1, 3], ["FSP", 3, 4, 2, 3], ["RE", 3, [0, 4, 1, 5, 2, 6, 3, 7]], ["CA", 2, 3, 5], ["CHR", 1, "shared", [2]], ["CA", 2, 3, 6], ["CHR", 0, "shared", [3]], ["CA", 1, 4, 6], ["FU", 5, [0, 1]], ["AN", 5, 0, 5], ["FU", 5, [1, 2]], ["AN", 5, 1, 4], ["FU", 5, [2, 3]], ["AN", 5, 2, 6], ["FU", 3, [0, 1]], ["SP", 3, 0, 8, [1], 1], ["AN", 3, 1, 2], ["FFSP", 3, 0, [2, 1], 1, 1], ["AN", 3, 1, 6], ["FU", 1, [0, 1]], ["SP", 1, 0, 32, [32], 1], ["AN", 1, 1, 2], ["FFSP", 1, 0, [2, 1], 1, 1], ["AN", 1, 1, 6], ["PR", 4, 0, "auto_unroll_max_step$512"]]]], "r": [[9.48814e-05], 0, 6.96993, 1652873259], "v": "v0.6"}
{"i": [["[\"matmul\", 1024, 1024, 1, \"float32\"]", "cuda -keys=cuda,gpu -arch=sm_80 -max_num_threads=1024 -thread_warp_size=32", [-1, 16, 64, 49152, 2147483647, 1024, 8, 32], "", 0, []], [[], [["CHW", 2, "local"], ["SP", 2, 0, 1024, [2, 64, 4, 1], 1], ["SP", 2, 5, 1024, [4, 2, 1, 32], 1], ["SP", 2, 10, 1, [1, 1], 1], ["RE", 2, [0, 5, 1, 6, 2, 7, 10, 11, 3, 8, 12, 4, 9]], ["FSP", 3, 0, 1, 3], ["FSP", 3, 4, 2, 3], ["RE", 3, [0, 4, 1, 5, 2, 6, 3, 7]], ["CA", 2, 3, 5], ["CHR", 1, "shared", [2]], ["CA", 2, 3, 6], ["CHR", 0, "shared", [3]], ["CA", 1, 4, 6], ["FU", 5, [0, 1]], ["AN", 5, 0, 5], ["FU", 5, [1, 2]], ["AN", 5, 1, 4], ["FU", 5, [2, 3]], ["AN", 5, 2, 6], ["FU", 3, [0, 1]], ["SP", 3, 0, 64, [1], 1], ["AN", 3, 1, 2], ["FFSP", 3, 0, [2, 1], 1, 1], ["AN", 3, 1, 6], ["FU", 1, [0, 1]], ["SP", 1, 0, 4, [4], 1], ["AN", 1, 1, 2], ["FFSP", 1, 0, [2, 1], 1, 1], ["AN", 1, 1, 6], ["PR", 4, 0, "auto_unroll_max_step$16"]]]], "r": [[0.000220082], 0, 3.77725, 1652873260], "v": "v0.6"}
{"i": [["[\"matmul\", 1024, 1024, 1, \"float32\"]", "cuda -keys=cuda,gpu -arch=sm_80 -max_num_threads=1024 -thread_warp_size=32", [-1, 16, 64, 49152, 2147483647, 1024, 8, 32], "", 0, []], [[], [["CHW", 2, "local"], ["SP", 2, 0, 1024, [2, 64, 1, 4], 1], ["SP", 2, 5, 1024, [1, 1, 4, 16], 1], ["SP", 2, 10, 1, [1, 1], 1], ["RE", 2, [0, 5, 1, 6, 2, 7, 10, 11, 3, 8, 12, 4, 9]], ["FSP", 3, 0, 1, 3], ["FSP", 3, 4, 2, 3], ["RE", 3, [0, 4, 1, 5, 2, 6, 3, 7]], ["CA", 2, 3, 5], ["CHR", 1, "shared", [2]], ["CA", 2, 3, 6], ["CHR", 0, "shared", [3]], ["CA", 1, 4, 6], ["FU", 5, [0, 1]], ["AN", 5, 0, 5], ["FU", 5, [1, 2]], ["AN", 5, 1, 4], ["FU", 5, [2, 3]], ["AN", 5, 2, 6], ["FU", 3, [0, 1]], ["SP", 3, 0, 64, [2], 1], ["AN", 3, 1, 2], ["FFSP", 3, 0, [2, 1], 1, 1], ["AN", 3, 1, 6], ["FU", 1, [0, 1]], ["SP", 1, 0, 4, [4], 1], ["AN", 1, 1, 2], ["FFSP", 1, 0, [2, 1], 1, 1], ["AN", 1, 1, 6], ["PR", 4, 0, "auto_unroll_max_step$64"]]]], "r": [[6.37345e-05], 0, 2.90306, 1652873261], "v": "v0.6"}
{"i": [["[\"matmul\", 1024, 1024, 1, \"float32\"]", "cuda -keys=cuda,gpu -arch=sm_80 -max_num_threads=1024 -thread_warp_size=32", [-1, 16, 64, 49152, 2147483647, 1024, 8, 32], "", 0, []], [[], [["CHW", 2, "local"], ["SP", 2, 0, 1024, [4, 32, 2, 1], 1], ["SP", 2, 5, 1024, [2, 1, 32, 2], 1], ["SP", 2, 10, 1, [1, 1], 1], ["RE", 2, [0, 5, 1, 6, 2, 7, 10, 11, 3, 8, 12, 4, 9]], ["FSP", 3, 0, 1, 3], ["FSP", 3, 4, 2, 3], ["RE", 3, [0, 4, 1, 5, 2, 6, 3, 7]], ["CA", 2, 3, 5], ["CHR", 1, "shared", [2]], ["CA", 2, 3, 6], ["CHR", 0, "shared", [3]], ["CA", 1, 4, 6], ["FU", 5, [0, 1]], ["AN", 5, 0, 5], ["FU", 5, [1, 2]], ["AN", 5, 1, 4], ["FU", 5, [2, 3]], ["AN", 5, 2, 6], ["FU", 3, [0, 1]], ["SP", 3, 0, 128, [1], 1], ["AN", 3, 1, 2], ["FFSP", 3, 0, [2, 1], 1, 1], ["AN", 3, 1, 6], ["FU", 1, [0, 1]], ["SP", 1, 0, 2, [2], 1], ["AN", 1, 1, 2], ["FFSP", 1, 0, [2, 1], 1, 1], ["AN", 1, 1, 6], ["PR", 4, 0, "auto_unroll_max_step$1024"]]]], "r": [[5.62262e-05], 0, 6.88779, 1652873262], "v": "v0.6"}
{"i": [["[\"matmul\", 1024, 1024, 1, \"float32\"]", "cuda -keys=cuda,gpu -arch=sm_80 -max_num_threads=1024 -thread_warp_size=32", [-1, 16, 64, 49152, 2147483647, 1024, 8, 32], "", 0, []], [[], [["CHW", 2, "local"], ["SP", 2, 0, 1024, [1, 256, 1, 1], 1], ["SP", 2, 5, 1024, [2, 1, 2, 8], 1], ["SP", 2, 10, 1, [1, 1], 1], ["RE", 2, [0, 5, 1, 6, 2, 7, 10, 11, 3, 8, 12, 4, 9]], ["FSP", 3, 0, 1, 3], ["FSP", 3, 4, 2, 3], ["RE", 3, [0, 4, 1, 5, 2, 6, 3, 7]], ["CA", 2, 3, 5], ["CHR", 1, "shared", [2]], ["CA", 2, 3, 6], ["CHR", 0, "shared", [3]], ["CA", 1, 4, 6], ["FU", 5, [0, 1]], ["AN", 5, 0, 5], ["FU", 5, [1, 2]], ["AN", 5, 1, 4], ["FU", 5, [2, 3]], ["AN", 5, 2, 6], ["FU", 3, [0, 1]], ["SP", 3, 0, 16, [1], 1], ["AN", 3, 1, 2], ["FFSP", 3, 0, [2, 1], 1, 1], ["AN", 3, 1, 6], ["FU", 1, [0, 1]], ["SP", 1, 0, 1, [1], 1], ["AN", 1, 1, 2], ["FFSP", 1, 0, [2, 1], 1, 1], ["AN", 1, 1, 6], ["PR", 4, 0, "auto_unroll_max_step$16"]]]], "r": [[3.50504e-05], 0, 1.80623, 1652873264], "v": "v0.6"}
{"i": [["[\"matmul\", 1024, 1024, 1, \"float32\"]", "cuda -keys=cuda,gpu -arch=sm_80 -max_num_threads=1024 -thread_warp_size=32", [-1, 16, 64, 49152, 2147483647, 1024, 8, 32], "", 0, []], [[], [["CHW", 2, "local"], ["SP", 2, 0, 1024, [1, 4, 4, 4], 1], ["SP", 2, 5, 1024, [4, 32, 4, 1], 1], ["SP", 2, 10, 1, [1, 1], 1], ["RE", 2, [0, 5, 1, 6, 2, 7, 10, 11, 3, 8, 12, 4, 9]], ["FSP", 3, 0, 1, 3], ["FSP", 3, 4, 2, 3], ["RE", 3, [0, 4, 1, 5, 2, 6, 3, 7]], ["CA", 2, 3, 5], ["CHR", 1, "shared", [2]], ["CA", 2, 3, 6], ["CHR", 0, "shared", [3]], ["CA", 1, 4, 6], ["FU", 5, [0, 1]], ["AN", 5, 0, 5], ["FU", 5, [1, 2]], ["AN", 5, 1, 4], ["FU", 5, [2, 3]], ["AN", 5, 2, 6], ["FU", 3, [0, 1]], ["SP", 3, 0, 8, [1], 1], ["AN", 3, 1, 2], ["FFSP", 3, 0, [2, 1], 1, 1], ["AN", 3, 1, 6], ["FU", 1, [0, 1]], ["SP", 1, 0, 16, [1], 1], ["AN", 1, 1, 2], ["FFSP", 1, 0, [2, 1], 1, 1], ["AN", 1, 1, 6], ["PR", 4, 0, "auto_unroll_max_step$0"]]]], "r": [[1.77232e-05], 0, 2.08683, 1652873265], "v": "v0.6"}
{"i": [["[\"matmul\", 1024, 1024, 1, \"float32\"]", "cuda -keys=cuda,gpu -arch=sm_80 -max_num_threads=1024 -thread_warp_size=32", [-1, 16, 64, 49152, 2147483647, 1024, 8, 32], "", 0, []], [[], [["CHW", 2, "local"], ["SP", 2, 0, 1024, [2, 32, 2, 8], 1], ["SP", 2, 5, 1024, [1, 16, 1, 4], 1], ["SP", 2, 10, 1, [1, 1], 1], ["RE", 2, [0, 5, 1, 6, 2, 7, 10, 11, 3, 8, 12, 4, 9]], ["FSP", 3, 0, 1, 3], ["FSP", 3, 4, 2, 3], ["RE", 3, [0, 4, 1, 5, 2, 6, 3, 7]], ["CA", 2, 3, 5], ["CHR", 1, "shared", [2]], ["CA", 2, 3, 6], ["CHR", 0, "shared", [3]], ["CA", 1, 4, 6], ["FU", 5, [0, 1]], ["AN", 5, 0, 5], ["FU", 5, [1, 2]], ["AN", 5, 1, 4], ["FU", 5, [2, 3]], ["AN", 5, 2, 6], ["FU", 3, [0, 1]], ["SP", 3, 0, 4, [1], 1], ["AN", 3, 1, 2], ["FFSP", 3, 0, [2, 1], 1, 1], ["AN", 3, 1, 6], ["FU", 1, [0, 1]], ["SP", 1, 0, 16, [1], 1], ["AN", 1, 1, 2], ["FFSP", 1, 0, [2, 1], 1, 1], ["AN", 1, 1, 6], ["PR", 4, 0, "auto_unroll_max_step$512"]]]], "r": [[3.08235e-05], 0, 2.02737, 1652873266], "v": "v0.6"}
{"i": [["[\"matmul\", 1024, 1024, 1, \"float32\"]", "cuda -keys=cuda,gpu -arch=sm_80 -max_num_threads=1024 -thread_warp_size=32", [-1, 16, 64, 49152, 2147483647, 1024, 8, 32], "", 0, []], [[], [["CHW", 2, "local"], ["SP", 2, 0, 1024, [1, 8, 128, 1], 1], ["SP", 2, 5, 1024, [4, 8, 4, 2], 1], ["SP", 2, 10, 1, [1, 1], 1], ["RE", 2, [0, 5, 1, 6, 2, 7, 10, 11, 3, 8, 12, 4, 9]], ["FSP", 3, 0, 1, 3], ["FSP", 3, 4, 2, 3], ["RE", 3, [0, 4, 1, 5, 2, 6, 3, 7]], ["CA", 2, 3, 5], ["CHR", 1, "shared", [2]], ["CA", 2, 3, 6], ["CHR", 0, "shared", [3]], ["CA", 1, 4, 6], ["FU", 5, [0, 1]], ["AN", 5, 0, 5], ["FU", 5, [1, 2]], ["AN", 5, 1, 4], ["FU", 5, [2, 3]], ["AN", 5, 2, 6], ["FU", 3, [0, 1]], ["SP", 3, 0, 8, [2], 1], ["AN", 3, 1, 2], ["FFSP", 3, 0, [2, 1], 1, 1], ["AN", 3, 1, 6], ["FU", 1, [0, 1]], ["SP", 1, 0, 128, [1], 1], ["AN", 1, 1, 2], ["FFSP", 1, 0, [2, 1], 1, 1], ["AN", 1, 1, 6], ["PR", 4, 0, "auto_unroll_max_step$16"]]]], "r": [[0.000187281], 0, 2.02874, 1652873267], "v": "v0.6"}
{"i": [["[\"matmul\", 1024, 1024, 1, \"float32\"]", "cuda -keys=cuda,gpu -arch=sm_80 -max_num_threads=1024 -thread_warp_size=32", [-1, 16, 64, 49152, 2147483647, 1024, 8, 32], "", 0, []], [[], [["CHW", 2, "local"], ["SP", 2, 0, 1024, [1, 8, 4, 16], 1], ["SP", 2, 5, 1024, [8, 4, 16, 2], 1], ["SP", 2, 10, 1, [1, 1], 1], ["RE", 2, [0, 5, 1, 6, 2, 7, 10, 11, 3, 8, 12, 4, 9]], ["FSP", 3, 0, 1, 3], ["FSP", 3, 4, 2, 3], ["RE", 3, [0, 4, 1, 5, 2, 6, 3, 7]], ["CA", 2, 3, 5], ["CHR", 1, "shared", [2]], ["CA", 2, 3, 6], ["CHR", 0, "shared", [3]], ["CA", 1, 4, 6], ["FU", 5, [0, 1]], ["AN", 5, 0, 5], ["FU", 5, [1, 2]], ["AN", 5, 1, 4], ["FU", 5, [2, 3]], ["AN", 5, 2, 6], ["FU", 3, [0, 1]], ["SP", 3, 0, 32, [1], 1], ["AN", 3, 1, 2], ["FFSP", 3, 0, [2, 1], 1, 1], ["AN", 3, 1, 6], ["FU", 1, [0, 1]], ["SP", 1, 0, 64, [1], 1], ["AN", 1, 1, 2], ["FFSP", 1, 0, [2, 1], 1, 1], ["AN", 1, 1, 6], ["PR", 4, 0, "auto_unroll_max_step$16"]]]], "r": [[0.000961288], 0, 3.1652, 1652873269], "v": "v0.6"}
{"i": [["[\"matmul\", 1024, 1024, 1, \"float32\"]", "cuda -keys=cuda,gpu -arch=sm_80 -max_num_threads=1024 -thread_warp_size=32", [-1, 16, 64, 49152, 2147483647, 1024, 8, 32], "", 0, []], [[], [["CHW", 2, "local"], ["SP", 2, 0, 1024, [1, 32, 8, 2], 1], ["SP", 2, 5, 1024, [2, 2, 8, 16], 1], ["SP", 2, 10, 1, [1, 1], 1], ["RE", 2, [0, 5, 1, 6, 2, 7, 10, 11, 3, 8, 12, 4, 9]], ["FSP", 3, 0, 1, 3], ["FSP", 3, 4, 2, 3], ["RE", 3, [0, 4, 1, 5, 2, 6, 3, 7]], ["CA", 2, 3, 5], ["CHR", 1, "shared", [2]], ["CA", 2, 3, 6], ["CHR", 0, "shared", [3]], ["CA", 1, 4, 6], ["FU", 5, [0, 1]], ["AN", 5, 0, 5], ["FU", 5, [1, 2]], ["AN", 5, 1, 4], ["FU", 5, [2, 3]], ["AN", 5, 2, 6], ["FU", 3, [0, 1]], ["SP", 3, 0, 128, [1], 1], ["AN", 3, 1, 2], ["FFSP", 3, 0, [2, 1], 1, 1], ["AN", 3, 1, 6], ["FU", 1, [0, 1]], ["SP", 1, 0, 16, [1], 1], ["AN", 1, 1, 2], ["FFSP", 1, 0, [2, 1], 1, 1], ["AN", 1, 1, 6], ["PR", 4, 0, "auto_unroll_max_step$64"]]]], "r": [[0.000453536], 0, 3.44688, 1652873270], "v": "v0.6"}
{"i": [["[\"matmul\", 1024, 1024, 1, \"float32\"]", "cuda -keys=cuda,gpu -arch=sm_80 -max_num_threads=1024 -thread_warp_size=32", [-1, 16, 64, 49152, 2147483647, 1024, 8, 32], "", 0, []], [[], [["CHW", 2, "local"], ["SP", 2, 0, 1024, [8, 1, 4, 16], 1], ["SP", 2, 5, 1024, [1, 32, 1, 2], 1], ["SP", 2, 10, 1, [1, 1], 1], ["RE", 2, [0, 5, 1, 6, 2, 7, 10, 11, 3, 8, 12, 4, 9]], ["FSP", 3, 0, 1, 3], ["FSP", 3, 4, 2, 3], ["RE", 3, [0, 4, 1, 5, 2, 6, 3, 7]], ["CA", 2, 3, 5], ["CHR", 1, "shared", [2]], ["CA", 2, 3, 6], ["CHR", 0, "shared", [3]], ["CA", 1, 4, 6], ["FU", 5, [0, 1]], ["AN", 5, 0, 5], ["FU", 5, [1, 2]], ["AN", 5, 1, 4], ["FU", 5, [2, 3]], ["AN", 5, 2, 6], ["FU", 3, [0, 1]], ["SP", 3, 0, 2, [1], 1], ["AN", 3, 1, 2], ["FFSP", 3, 0, [2, 1], 1, 1], ["AN", 3, 1, 6], ["FU", 1, [0, 1]], ["SP", 1, 0, 64, [1], 1], ["AN", 1, 1, 2], ["FFSP", 1, 0, [2, 1], 1, 1], ["AN", 1, 1, 6], ["PR", 4, 0, "auto_unroll_max_step$16"]]]], "r": [[2.11602e-05], 0, 3.27013, 1652873271], "v": "v0.6"}
{"i": [["[\"matmul\", 1024, 1024, 1, \"float32\"]", "cuda -keys=cuda,gpu -arch=sm_80 -max_num_threads=1024 -thread_warp_size=32", [-1, 16, 64, 49152, 2147483647, 1024, 8, 32], "", 0, []], [[], [["CHW", 2, "local"], ["SP", 2, 0, 1024, [1, 64, 4, 4], 1], ["SP", 2, 5, 1024, [1, 16, 2, 2], 1], ["SP", 2, 10, 1, [1, 1], 1], ["RE", 2, [0, 5, 1, 6, 2, 7, 10, 11, 3, 8, 12, 4, 9]], ["FSP", 3, 0, 1, 3], ["FSP", 3, 4, 2, 3], ["RE", 3, [0, 4, 1, 5, 2, 6, 3, 7]], ["CA", 2, 3, 5], ["CHR", 1, "shared", [2]], ["CA", 2, 3, 6], ["CHR", 0, "shared", [3]], ["CA", 1, 4, 6], ["FU", 5, [0, 1]], ["AN", 5, 0, 5], ["FU", 5, [1, 2]], ["AN", 5, 1, 4], ["FU", 5, [2, 3]], ["AN", 5, 2, 6], ["FU", 3, [0, 1]], ["SP", 3, 0, 4, [1], 1], ["AN", 3, 1, 2], ["FFSP", 3, 0, [2, 1], 1, 1], ["AN", 3, 1, 6], ["FU", 1, [0, 1]], ["SP", 1, 0, 16, [8], 1], ["AN", 1, 1, 2], ["FFSP", 1, 0, [2, 1], 1, 1], ["AN", 1, 1, 6], ["PR", 4, 0, "auto_unroll_max_step$64"]]]], "r": [[3.20423e-05], 0, 1.79368, 1652873286], "v": "v0.6"}
{"i": [["[\"matmul\", 1024, 1024, 1, \"float32\"]", "cuda -keys=cuda,gpu -arch=sm_80 -max_num_threads=1024 -thread_warp_size=32", [-1, 16, 64, 49152, 2147483647, 1024, 8, 32], "", 0, []], [[], [["CHW", 2, "local"], ["SP", 2, 0, 1024, [2, 8, 64, 1], 1], ["SP", 2, 5, 1024, [1, 8, 1, 2], 1], ["SP", 2, 10, 1, [1, 1], 1], ["RE", 2, [0, 5, 1, 6, 2, 7, 10, 11, 3, 8, 12, 4, 9]], ["FSP", 3, 0, 1, 3], ["FSP", 3, 4, 2, 3], ["RE", 3, [0, 4, 1, 5, 2, 6, 3, 7]], ["CA", 2, 3, 5], ["CHR", 1, "shared", [2]], ["CA", 2, 3, 6], ["CHR", 0, "shared", [3]], ["CA", 1, 4, 6], ["FU", 5, [0, 1]], ["AN", 5, 0, 5], ["FU", 5, [1, 2]], ["AN", 5, 1, 4], ["FU", 5, [2, 3]], ["AN", 5, 2, 6], ["FU", 3, [0, 1]], ["SP", 3, 0, 2, [2], 1], ["AN", 3, 1, 2], ["FFSP", 3, 0, [2, 1], 1, 1], ["AN", 3, 1, 6], ["FU", 1, [0, 1]], ["SP", 1, 0, 64, [64], 1], ["AN", 1, 1, 2], ["FFSP", 1, 0, [2, 1], 1, 1], ["AN", 1, 1, 6], ["PR", 4, 0, "auto_unroll_max_step$512"]]]], "r": [[6.48883e-06], 0, 2.48747, 1652873287], "v": "v0.6"}
{"i": [["[\"matmul\", 1024, 1024, 1, \"float32\"]", "cuda -keys=cuda,gpu -arch=sm_80 -max_num_threads=1024 -thread_warp_size=32", [-1, 16, 64, 49152, 2147483647, 1024, 8, 32], "", 0, []], [[], [["CHW", 2, "local"], ["SP", 2, 0, 1024, [4, 4, 16, 1], 1], ["SP", 2, 5, 1024, [1, 1, 32, 1], 1], ["SP", 2, 10, 1, [1, 1], 1], ["RE", 2, [0, 5, 1, 6, 2, 7, 10, 11, 3, 8, 12, 4, 9]], ["FSP", 3, 0, 1, 3], ["FSP", 3, 4, 2, 3], ["RE", 3, [0, 4, 1, 5, 2, 6, 3, 7]], ["CA", 2, 3, 5], ["CHR", 1, "shared", [2]], ["CA", 2, 3, 6], ["CHR", 0, "shared", [3]], ["CA", 1, 4, 6], ["FU", 5, [0, 1]], ["AN", 5, 0, 5], ["FU", 5, [1, 2]], ["AN", 5, 1, 4], ["FU", 5, [2, 3]], ["AN", 5, 2, 6], ["FU", 3, [0, 1]], ["SP", 3, 0, 16, [2], 1], ["AN", 3, 1, 2], ["FFSP", 3, 0, [2, 1], 1, 1], ["AN", 3, 1, 6], ["FU", 1, [0, 1]], ["SP", 1, 0, 4, [1], 1], ["AN", 1, 1, 2], ["FFSP", 1, 0, [2, 1], 1, 1], ["AN", 1, 1, 6], ["PR", 4, 0, "auto_unroll_max_step$64"]]]], "r": [[0.000124034], 0, 2.80794, 1652873288], "v": "v0.6"}
{"i": [["[\"matmul\", 1024, 1024, 1, \"float32\"]", "cuda -keys=cuda,gpu -arch=sm_80 -max_num_threads=1024 -thread_warp_size=32", [-1, 16, 64, 49152, 2147483647, 1024, 8, 32], "", 0, []], [[], [["CHW", 2, "local"], ["SP", 2, 0, 1024, [4, 32, 1, 2], 1], ["SP", 2, 5, 1024, [1, 1, 512, 1], 1], ["SP", 2, 10, 1, [1, 1], 1], ["RE", 2, [0, 5, 1, 6, 2, 7, 10, 11, 3, 8, 12, 4, 9]], ["FSP", 3, 0, 1, 3], ["FSP", 3, 4, 2, 3], ["RE", 3, [0, 4, 1, 5, 2, 6, 3, 7]], ["CA", 2, 3, 5], ["CHR", 1, "shared", [2]], ["CA", 2, 3, 6], ["CHR", 0, "shared", [3]], ["CA", 1, 4, 6], ["FU", 5, [0, 1]], ["AN", 5, 0, 5], ["FU", 5, [1, 2]], ["AN", 5, 1, 4], ["FU", 5, [2, 3]], ["AN", 5, 2, 6], ["FU", 3, [0, 1]], ["SP", 3, 0, 512, [1], 1], ["AN", 3, 1, 2], ["FFSP", 3, 0, [2, 1], 1, 1], ["AN", 3, 1, 6], ["FU", 1, [0, 1]], ["SP", 1, 0, 8, [2], 1], ["AN", 1, 1, 2], ["FFSP", 1, 0, [2, 1], 1, 1], ["AN", 1, 1, 6], ["PR", 4, 0, "auto_unroll_max_step$512"]]]], "r": [[0.0002477], 0, 2.08318, 1652873290], "v": "v0.6"}
